Bitcoin,https://www.crunchbase.com/organization/bitcoin-llc,Growing,Private,For Profit,101-250,,Venture - Series Unknown,2020-11-30,,2008-01-01,year,Active,,,2,3,,14086804,USD,14086804,14086804,USD,14086804,Venture - Series Unknown,14208804,USD,14208804,14208804,USD,14208804,"Breyer Labs, Larry Zhao, Simon Marquez, Ed King",4,"San Francisco Bay Area, West Coast, Western US","Blockchain and Cryptocurrency, Financial Services, Hardware, Media and Entertainment, Payments, Software",,High,,,,"Bitcoin, Communications Infrastructure, Hardware, Media and Entertainment","San Francisco, California, United States",
TON Provider,https://www.crunchbase.com/organization/ton-provider,Growing,Private,For Profit,1-10,,Seed,2023-11-29,,2021-09-15,day,Active,,,1,2,Seed,2500000,USD,2500000,2500000,USD,2500000,Seed,4134090,USD,4134090,4134090,USD,4134090,,,"Europe, Middle East, and Africa (EMEA)","Blockchain and Cryptocurrency, Hardware, Information Technology, Internet Services, Other, Software",,High,,,,"Blockchain, Data Center, Information Technology, Infrastructure, Internet, IT Infrastructure, Network Hardware, Software","Zürich, Zurich, Switzerland",
Polymarket,https://www.crunchbase.com/organization/polymarket,Growing,Private,For Profit,11-50,,Series B,2024-05-14,,2020-03-01,month,Active,,,1,3,Early Stage Venture,45000000,USD,45000000,45000000,USD,45000000,Series B,74000000,USD,74000000,74000000,USD,74000000,"General Catalyst, Polychain, Robot Ventures, Balaji Srinivasan, Founders Fund",20,"Greater New York Area, East Coast, Northeastern US","Artificial Intelligence (AI), Blockchain and Cryptocurrency, Data and Analytics, Financial Services, Other, Payments, Software",,High,,,,"Blockchain, Cryptocurrency, Predictive Analytics","New York, New York, United States",
Chainguard,https://www.crunchbase.com/organization/chainguard,Growing,Private,For Profit,101-250,,Series C,2024-07-25,,2021-10-01,month,Active,,,3,4,Late Stage Venture,140000000,USD,140000000,140000000,USD,140000000,Series C,256000000,USD,256000000,256000000,USD,256000000,"Sequoia Capital, Lightspeed Venture Partners, K5 Global, Redpoint, MANTIS Venture Capital",19,"Greater Seattle Area, West Coast, Western US","Information Technology, Privacy and Security, Software",,,,,,"Cloud Security, Developer Tools, Enterprise Software, Open Source, Security","Kirkland, Washington, United States",
Cyble,https://www.crunchbase.com/organization/cyble,Growing,Private,For Profit,251-500,,Series B,2023-11-14,,2019-01-01,year,Active,,,2,11,Early Stage Venture,6200000,USD,6200000,6200000,USD,6200000,Series B,44807000,USD,44807000,44807000,USD,44807000,"Blackbird Ventures, Y Combinator, VentureSouq, King River Capital, Picus Capital",14,"Greater Atlanta Area, East Coast, Southern US","Artificial Intelligence (AI), Data and Analytics, Information Technology, Privacy and Security, Professional Services, Science and Engineering, Software",,High,,,,"Artificial Intelligence (AI), Cloud Security, Cyber Security, Risk Management, Software","Alpharetta, Georgia, United States",
xAI,https://www.crunchbase.com/organization/xai,Growing,Private,For Profit,11-50,,Series B,2024-05-26,,2023-07-12,day,Active,,,5,3,Early Stage Venture,6000000000,USD,6000000000,6000000000,USD,6000000000,Series B,6384679312,USD,6384679312,6384679312,USD,6384679312,"Fidelity, Andreessen Horowitz, Sequoia Capital, Kingdom Holding Company, X (formerly Twitter)",17,"San Francisco Bay Area, West Coast, Western US","Artificial Intelligence (AI), Data and Analytics, Information Technology, Science and Engineering, Software",,High,,,,"Artificial Intelligence (AI), Generative AI, Information Technology, Machine Learning","Burlingame, California, United States",
Drip Capital,https://www.crunchbase.com/organization/drip-capital,Growing,Private,For Profit,251-500,,Debt Financing,2024-09-05,,2015-01-01,year,Active,,,2,17,,90000000,USD,90000000,23000000,USD,23000000,Venture - Series Unknown,108120000,USD,108120000,528120000,USD,528120000,"International Finance Corporation, Y Combinator, Accel, Sumitomo Mitsui Banking Corporation, Peak XV Partners",30,"San Francisco Bay Area, Silicon Valley, West Coast",Financial Services,$100M to $500M,High,,,,"Finance, Financial Services, FinTech","Palo Alto, California, United States",
Monarch Tractor,https://www.crunchbase.com/organization/monarch-tractors,Growing,Private,For Profit,251-500,,Grant,2024-08-19,,2017-01-01,year,Active,,,4,5,Late Stage Venture,,,,133000000,USD,133000000,Series C,214000000,USD,214000000,214000000,USD,214000000,"CNH Industrial, Sahin Boydas, Astanor Ventures, PMV, Twynam Agricultural Group",14,"San Francisco Bay Area, West Coast, Western US","Agriculture and Farming, Artificial Intelligence (AI), Data and Analytics, Science and Engineering, Software, Transportation",,High,,,,"Agriculture, AgTech, Analytics, Artificial Intelligence (AI), Electric Vehicle, Farming","Livermore, California, United States",
EGenesis,https://www.crunchbase.com/organization/egenesis,Growing,Private,For Profit,101-250,Made Acquisitions,Series D,2024-09-04,,2014-01-01,year,Active,Yes,,3,5,Late Stage Venture,191000000,USD,191000000,191000000,USD,191000000,Series D,454000000,USD,454000000,456000000,USD,456000000,"Khosla Ventures, DaVita, Fresenius Medical Care, Polaris Partners, Invus",31,"Greater Boston Area, East Coast, New England","Biotechnology, Health Care, Science and Engineering",$500M to $1B,,,,,"Biopharma, Biotechnology, Genetics, Life Science, Medical","Cambridge, Massachusetts, United States",
Saronic,https://www.crunchbase.com/organization/saronic,Growing,Private,For Profit,101-250,,Series B,2024-07-19,,2022-09-01,month,Active,,,4,3,Early Stage Venture,175000000,USD,175000000,175000000,USD,175000000,Series B,245000000,USD,245000000,245000000,USD,245000000,"Andreessen Horowitz, Lightspeed Venture Partners, Point72 Ventures, 8VC, NightDragon",12,Southern US,"Artificial Intelligence (AI), Data and Analytics, Government and Military, Information Technology, Manufacturing, Privacy and Security, Science and Engineering, Software",,High,,,,"Artificial Intelligence (AI), Manufacturing, Marine Technology, Military, National Security, Security","Austin, Texas, United States",
H.I.G. Capital,https://www.crunchbase.com/organization/hig-capital,Growing,Private,For Profit,501-1000,Made Acquisitions,Venture - Series Unknown,2016-12-12,Private Equity Firm,1993-01-01,year,Active,,"Debt, Early Stage Venture, Late Stage Venture, Post-Ipo, Private Equity, Venture",2,2,,36475924,USD,36475924,36475924,USD,36475924,Venture - Series Unknown,36475924,USD,36475924,36475924,USD,36475924,Dyal Capital Partners,1,"Greater Miami Area, East Coast, Southern US","Financial Services, Lending and Investments, Real Estate",,Low,,,,"Credit, Finance, Financial Services, Insurance, Real Estate","Miami, Florida, United States",153
Cyberint,https://www.crunchbase.com/organization/cyberint,Growing,Private,For Profit,101-250,Was Acquired,Series C,2022-06-21,,2009-01-01,year,Active,,,3,4,M&A,28000000,USD,28000000,28000000,USD,28000000,Series C,56000000,USD,56000000,68000000,USD,68000000,"Bank Leumi, StageOne Ventures, Neva SGR, Viola Growth, Dov Baharav",8,"Europe, Middle East, and Africa (EMEA), Middle East, Middle East and North Africa (MENA)","Financial Services, Information Technology, Payments, Privacy and Security, Software",,,,,,"Cyber Security, Fraud Detection, Network Security, Security, Software","Petah Tiqva, HaMerkaz, Israel",
Gro Intelligence,https://www.crunchbase.com/organization/gro-intelligence,Growing,Private,For Profit,101-250,,Series B,2021-01-08,,2014-01-01,year,Closed,,,1,5,Early Stage Venture,85000000,USD,85000000,85000000,USD,85000000,Series B,114700000,USD,114700000,117609000,USD,117609000,"Intel Capital, DCVC, Notable Capital, One Planet Group, TPG Growth",13,"Greater New York Area, East Coast, Northeastern US","Agriculture and Farming, Artificial Intelligence (AI), Data and Analytics, Design, Information Technology, Science and Engineering, Software",,,,,,"Agriculture, Artificial Intelligence (AI), Big Data, Data Visualization, Information Technology, SaaS","New York, New York, United States",
Reliance Jio,https://www.crunchbase.com/organization/reliance-jio-infocomm-ltd-234,Growing,Private,For Profit,10001+,Made Acquisitions,Debt Financing,2023-10-03,,2007-01-01,year,Active,,,1,16,,166400000000,INR,1999338200,337370000000,INR,4489237314,Corporate Round,20049235082,USD,20049235082,28361990389,USD,28361990389,"Citi, HSBC, Standard Chartered Bank, Scotiabank, Meta",48,Asia-Pacific (APAC),"Apps, Consumer Electronics, Hardware, Information Technology, Internet Services, Software",,High,,,,"Apps, Consumer Electronics, Electronics, Information Services, Information Technology, Internet, Telecommunications","Mumbai, Maharashtra, India",3
Workato,https://www.crunchbase.com/organization/workato,Growing,Private,For Profit,501-1000,Made Acquisitions,Series E,2021-11-10,,2013-01-01,year,Active,,,5,5,Late Stage Venture,200000000,USD,200000000,200000000,USD,200000000,Series E,415000000,USD,415000000,415000000,USD,415000000,"Insight Partners, Tiger Global Management, Redpoint, Storm Ventures, ServiceNow",13,"San Francisco Bay Area, Silicon Valley, West Coast","Data and Analytics, Information Technology, Internet Services, Sales and Marketing, Software",$1B to $10B,,,,,"Cloud Computing, Data Integration, Marketing Automation, SaaS, Sales Automation","Mountain View, California, United States",
Monzo,https://www.crunchbase.com/organization/monzo,Growing,Private,For Profit,1001-5000,,Series I,2024-05-08,,2015-02-01,month,Active,,,5,22,Late Stage Venture,150000000,GBP,187397868,150000000,GBP,187397868,Series I,1737168103,USD,1737168103,1737168103,USD,1737168103,"Stripe, Deliveroo, Tencent, Thrive Capital, Orange",50,"Europe, Middle East, and Africa (EMEA)","Financial Services, Lending and Investments",,High,,,,"Banking, Financial Services, FinTech, Wealth Management","London, England, United Kingdom",
Aavishkaar Venture Capital,https://www.crunchbase.com/organization/aavishkaar-goodwell,Growing,Private,For Profit,11-50,,Venture - Series Unknown,2019-09-26,Venture Capital,2001-01-01,year,Active,,"Early Stage Venture, Late Stage Venture, Secondary Market, Seed, Venture",1,2,,37000000,USD,37000000,37000000,USD,37000000,Venture - Series Unknown,62000000,USD,62000000,62000000,USD,62000000,"FMO, Triodos Bank, Shell Foundation",3,Asia-Pacific (APAC),"Financial Services, Lending and Investments",,Medium,,,,"Finance, Financial Services, Venture Capital","Mumbai, Maharashtra, India",92
Parry Labs,https://www.crunchbase.com/organization/parry-labs,Growing,Private,For Profit,251-500,,Series A,2024-08-28,,2015-01-01,year,Active,,,2,1,Early Stage Venture,80000000,USD,80000000,80000000,USD,80000000,Series A,80000000,USD,80000000,80000000,USD,80000000,"3Wire Partners, Teamworthy Ventures, True Ventures, Capitol Meridian Partners",4,"Washington DC Metro Area, East Coast, Southern US","Artificial Intelligence (AI), Data and Analytics, Government and Military, Information Technology, Science and Engineering, Software",,Medium,,,,"Artificial Intelligence (AI), Government, GovTech, Information Technology, National Security, Software","Alexandria, Virginia, United States",
Australian Renewable Energy Agency,https://www.crunchbase.com/organization/australian-renewable-energy-agency,Growing,Private,For Profit,51-100,,Undisclosed,2022-01-10,Government Office,2012-01-01,year,Active,,,,1,,40000000,USD,40000000,40000000,USD,40000000,Undisclosed,40000000,USD,40000000,40000000,USD,40000000,,,"Asia-Pacific (APAC), Australasia","Energy, Government and Military, Sustainability",,Medium,,,,"Energy, Energy Efficiency, Government, Renewable Energy","Canberra, Australian Capital Territory, Australia",419
BrowserStack,https://www.crunchbase.com/organization/browserstack,Growing,Private,For Profit,501-1000,Made Acquisitions,Series B,2021-06-16,,2011-09-01,day,Active,,,2,2,Early Stage Venture,200000000,USD,200000000,200000000,USD,200000000,Series B,250000000,USD,250000000,250000000,USD,250000000,"Accel, Insight Partners, Bond",3,"European Union (EU), Europe, Middle East, and Africa (EMEA)","Hardware, Internet Services, Software",,,,,,"Cloud Infrastructure, Developer Tools, SaaS, Software","Dublin, Dublin, Ireland",
EcoVadis,https://www.crunchbase.com/organization/ecovadis,Growing,Private,For Profit,1001-5000,Made Acquisitions,Secondary Market,2022-11-01,,2007-04-01,day,Active,,,2,8,Late Stage Venture,,,,500000000,USD,500000000,Series C,733286060,USD,733286060,735786060,USD,735786060,"BlackRock, Astorg, General Atlantic, GIC, Partech",11,"European Union (EU), Europe, Middle East, and Africa (EMEA)","Information Technology, Professional Services, Sustainability, Transportation",,,,,,"Information Services, Risk Management, Supply Chain Management, Sustainability","Paris, Ile-de-France, France",
Helsing,https://www.crunchbase.com/organization/helsing,Growing,Private,For Profit,251-500,,Series C,2024-07-11,,2021-01-01,year,Active,,,3,3,Late Stage Venture,450000000,EUR,488199671,450000000,EUR,488199671,Series C,761500000,EUR,829315371,761500000,EUR,829315371,"General Catalyst, Greenoaks, Accel, Lightspeed Venture Partners, Saab",9,"European Union (EU), Europe, Middle East, and Africa (EMEA)","Artificial Intelligence (AI), Data and Analytics, Government and Military, Information Technology, Science and Engineering, Software",,High,,,,"Artificial Intelligence (AI), Information Technology, Military, Software","Berlin, Berlin, Germany",
BillEase,https://www.crunchbase.com/organization/billease,Growing,Private,For Profit,251-500,,Series C,2024-09-03,,2015-09-01,day,Active,,,3,5,Late Stage Venture,,,,,,,Series C,11000000,USD,11000000,56000000,USD,56000000,"Helicap, Lendable, MDI Ventures, KB Investment, The Rise Fund",10,"Asia-Pacific (APAC), Association of Southeast Asian Nations (ASEAN), Southeast Asia","Financial Services, Payments, Software",,High,,,,"Finance, Financial Services, FinTech, Payments, Software","Makati, Manila, Philippines",
1Password,https://www.crunchbase.com/organization/1password,Growing,Private,For Profit,1001-5000,Made Acquisitions,Series C,2022-01-19,,2005-07-12,day,Active,,,4,3,Late Stage Venture,620000000,USD,620000000,620000000,USD,620000000,Series C,920135000,USD,920135000,920135000,USD,920135000,"Accel, Lightspeed Venture Partners, Tau Ventures, Tiger Global Management, ICONIQ Growth",37,Great Lakes,"Information Technology, Privacy and Security, Software",,Medium,,,,"Cyber Security, Network Security, Privacy, Software","Toronto, Ontario, Canada",
HomeLight,https://www.crunchbase.com/organization/homelight,Growing,Private,For Profit,501-1000,Made Acquisitions,Series D,2024-08-26,,2012-01-01,year,Active,,,3,15,Late Stage Venture,20000000,USD,20000000,20000000,USD,20000000,Series D,298500000,USD,298500000,762500000,USD,762500000,"Menlo Ventures, 500 Global, Ulu Ventures, Google Ventures, Citi Ventures",25,"Greater Phoenix Area, Western US",Real Estate,$1B to $10B,High,,,,"PropTech, Real Estate, Residential","Scottsdale, Arizona, United States",
Kiteworks,https://www.crunchbase.com/organization/kiteworks,Growing,Private,For Profit,251-500,Made Acquisitions,Private Equity,2024-08-14,,1999-01-01,year,Active,,,2,7,Private Equity,456000000,USD,456000000,456000000,USD,456000000,Private Equity,591410901,USD,591410901,592010901,USD,592010901,"Sixth Street, Insight Partners, Bregal Sagemount, Riverwood Capital",4,"San Francisco Bay Area, Silicon Valley, West Coast","Information Technology, Privacy and Security, Professional Services, Software",$100M to $500M,Medium,,,,"Cloud Security, Compliance, Enterprise Software, File Sharing, Security, Software","San Mateo, California, United States",
Opus Clip,https://www.crunchbase.com/organization/opus-clip,Growing,Private,For Profit,11-50,,Series A,2024-08-28,,2022-01-01,year,Active,,,,2,Early Stage Venture,30000000,USD,30000000,30000000,USD,30000000,Series A,30000000,USD,30000000,30000000,USD,30000000,"DCM Ventures, Samsung NEXT, GTMfund, Fellows Fund, Millennium New Horizons",5,"San Francisco Bay Area, Silicon Valley, West Coast","Artificial Intelligence (AI), Content and Publishing, Data and Analytics, Information Technology, Media and Entertainment, Science and Engineering, Software, Video",,High,,,,"Artificial Intelligence (AI), Generative AI, Information Technology, Software, Video Editing","Redwood City, California, United States",
Khosla Ventures,https://www.crunchbase.com/organization/khosla-ventures,Growing,Private,For Profit,101-250,,Seed,2017-07-02,Venture Capital,2004-01-01,year,Active,,"Early Stage Venture, Late Stage Venture, Post-Ipo, Seed, Venture",2,1,Seed,1500000,USD,1500000,1500000,USD,1500000,Seed,1500000,USD,1500000,1500000,USD,1500000,Raj Sareen,1,"San Francisco Bay Area, Silicon Valley, West Coast","Financial Services, Lending and Investments",,Medium,,,,"Finance, Financial Services, Venture Capital","Menlo Park, California, United States","1,221"
HouseEazy,https://www.crunchbase.com/organization/houseeazy,Growing,Private,For Profit,51-100,,Series A,2024-08-26,,2021-01-01,year,Active,,,2,4,Early Stage Venture,335000000,INR,3994883,335000000,INR,3994883,Series A,5332719,USD,5332719,8332719,USD,8332719,"Veena Jindal, Antler, Alteria Capital, ITI Growth Opportunities Fund, Chiratae Ventures",13,Asia-Pacific (APAC),Real Estate,,High,,,,"Property Management, PropTech, Real Estate, Residential","Noida, Uttar Pradesh, India",
Valsoft,https://www.crunchbase.com/organization/valsoft-corporation,Growing,Private,For Profit,1001-5000,Made Acquisitions,Private Equity,2024-01-19,,2015-04-10,day,Active,,,2,2,Private Equity,229000000,CAD,170127410,229000000,CAD,170127410,Private Equity,270127410,USD,270127410,270127410,USD,270127410,"Coatue, Viking Global Investors",2,,"Professional Services, Software",,Medium,,,,"Business Development, Software","Montréal, Quebec, Canada",
Zhipu AI,https://www.crunchbase.com/organization/zhipu-ai,Growing,Private,For Profit,501-1000,,Venture - Series Unknown,2024-09-05,,2019-01-01,year,Active,,,,7,,,,,,,,Venture - Series Unknown,400000000,USD,400000000,400000000,USD,400000000,"Alibaba Group, Meituan, Ant Group, Tencent, Qiming Venture Partners",23,Asia-Pacific (APAC),"Artificial Intelligence (AI), Data and Analytics, Information Technology, Science and Engineering, Software",,High,,,,"Artificial Intelligence (AI), Data Integration, Machine Learning, Software","Haidian, Beijing, China",9
Acronis,https://www.crunchbase.com/organization/acronis,Growing,Private,For Profit,1001-5000,"Made Acquisitions, Was Acquired",Private Equity,2022-07-29,,2003-01-01,year,Active,Yes,,5,4,M&A,250000000,USD,250000000,250000000,USD,250000000,Private Equity,658000000,USD,658000000,658000000,USD,658000000,"BlackRock, Goldman Sachs, Insight Partners, GS Growth, CVC Capital Partners",7,"Europe, Middle East, and Africa (EMEA)","Information Technology, Internet Services, Privacy and Security, Software",,,,,,"Cloud Data Services, Cloud Security, Cyber Security, Information Technology, Software","Schaffhausen, Schaffhausen, Switzerland",
Stripe,https://www.crunchbase.com/organization/stripe,Growing,Private,For Profit,5001-10000,Made Acquisitions,Secondary Market,2024-02-20,,2010-01-01,year,Active,,,2,19,Late Stage Venture,694159778,USD,694159778,6500000000,USD,6500000000,Series I,8735000000,USD,8735000000,9440247725,USD,9440247725,"Fidelity, Google, Khosla Ventures, Andreessen Horowitz, Thrive Capital",57,"San Francisco Bay Area, West Coast, Western US","Financial Services, Mobile, Payments, Software",$10B+,High,,,,"Finance, FinTech, Mobile Payments, SaaS","South San Francisco, California, United States",70
1Crowd,https://www.crunchbase.com/organization/1crowd,Growing,Private,For Profit,11-50,,Angel,2019-04-18,Venture Capital,2015-01-01,year,Active,,"Early Stage Venture, Seed, Venture",2,2,Seed,,,,,,,Angel,3500000,USD,3500000,3500000,USD,3500000,ANME,1,Asia-Pacific (APAC),"Financial Services, Lending and Investments, Other",,Medium,,,,"Crowdsourcing, Financial Services, Funding Platform, Venture Capital","Mumbai, Maharashtra, India",53
Export Development Canada,https://www.crunchbase.com/organization/export-development-canada,Growing,Private,For Profit,1001-5000,,Debt Financing,2024-06-12,Government Office,1944-11-01,day,Active,,"Debt, Private Equity",,1,,1000000000,USD,1000000000,,,,,,,,1000000000,USD,1000000000,,,Great Lakes,"Commerce and Shopping, Financial Services, Government and Military, Lending and Investments, Professional Services",,High,,,,"Finance, Government, Insurance, Retail, Risk Management, Venture Capital","Ottawa, Ontario, Canada",213
Sierra Space,https://www.crunchbase.com/organization/sierra-space,Growing,Private,For Profit,1001-5000,,Series B,2023-09-26,,2021-01-01,year,Active,,,2,2,Early Stage Venture,290000000,USD,290000000,290000000,USD,290000000,Series B,1690000000,USD,1690000000,1690000000,USD,1690000000,"Coatue, MUFG Bank, General Atlantic, Moore Strategic Ventures, AE Industrial Partners",8,"Greater Denver Area, Western US","Manufacturing, Science and Engineering, Transportation",,High,,,,"Advanced Materials, Aerospace, Industrial Manufacturing, Space Travel, Transportation","Louisville, Colorado, United States",
Revefi,https://www.crunchbase.com/organization/revefi,Growing,Private,For Profit,11-50,,Series A,2024-09-04,,2021-12-01,month,Active,,,2,2,Early Stage Venture,20000000,USD,20000000,20000000,USD,20000000,Series A,30500000,USD,30500000,30500000,USD,30500000,"Mayfield Fund, StepStone Group, Neythri Futures Fund, GTMfund, Icon Ventures",7,"Greater Seattle Area, West Coast, Western US","Artificial Intelligence (AI), Data and Analytics, Science and Engineering, Software",,Medium,,,,"Analytics, Artificial Intelligence (AI), Data Management, Enterprise Software, Generative AI","Redmond, Washington, United States",
Stonepeak,https://www.crunchbase.com/organization/stonepeak-infrastructure-partners,Growing,Private,For Profit,101-250,Made Acquisitions,Private Equity,2023-07-11,Private Equity Firm,2011-01-01,year,Active,,Private Equity,2,3,Private Equity,,,,,,,Private Equity,350000000,USD,350000000,350000000,USD,350000000,"Greenspring Associates, Dyal Capital Partners, Landmark Partners",3,"Greater New York Area, East Coast, Northeastern US","Financial Services, Lending and Investments, Other, Real Estate",,Medium,,,,"Asset Management, Infrastructure, Real Estate, Venture Capital","New York, New York, United States",42
Neptune Medical,https://www.crunchbase.com/organization/neptune-medical,Growing,Private,For Profit,101-250,,Series D,2024-08-15,,2016-01-01,year,Active,,,1,3,Late Stage Venture,97000000,USD,97000000,97000000,USD,97000000,Series D,97000000,USD,97000000,97000000,USD,97000000,"Olympus, Mighty Capital, Sonder Capital, Synergy Partners International, InCube Ventures",5,"San Francisco Bay Area, West Coast, Western US","Hardware, Health Care, Science and Engineering, Software",,,,,,"Health Care, Medical, Medical Device, Robotics","Burlingame, California, United States",
Syfe,https://www.crunchbase.com/organization/syfe,Growing,Private,For Profit,101-250,,Series C,2024-08-13,,2019-07-01,month,Active,,,1,4,Late Stage Venture,27000000,USD,27000000,27000000,USD,27000000,Series C,78920239,USD,78920239,78920239,USD,78920239,"Valar Ventures, Unbound, Rahul Mehta, Presight Capital, MPGI",12,"Asia-Pacific (APAC), Association of Southeast Asian Nations (ASEAN), Southeast Asia",Financial Services,,,,,,"Financial Services, FinTech, Wealth Management","Singapore, Central Region, Singapore",
Eight Sleep,https://www.crunchbase.com/organization/morphy,Growing,Private,For Profit,11-50,Made Acquisitions,Series C,2021-08-30,,2014-07-01,day,Active,,,4,12,Late Stage Venture,86000000,USD,86000000,86000000,USD,86000000,Series C,161446621,USD,161446621,162066621,USD,162066621,"SoftBank, Khosla Ventures, Stanford University, General Catalyst, Y Combinator",85,"Greater New York Area, East Coast, Northeastern US","Consumer Electronics, Hardware, Health Care",$100M to $500M,,,,,"Consumer Electronics, Health Care, Wellness","New York, New York, United States",2
EIT InnoEnergy,https://www.crunchbase.com/organization/kic-innoenergy,Growing,Private,For Profit,251-500,,Private Equity,2024-07-17,"Accelerator, Venture Capital",2010-01-01,day,Active,,"Early Stage Venture, Seed",2,3,Private Equity,,,,,,,Private Equity,140000000,EUR,150145158,140000000,EUR,150145158,"Societe Generale, Engie, Schneider Electric, ING Group, Capgemini",18,"European Union (EU), Europe, Middle East, and Africa (EMEA)","Energy, Sustainability",,Medium,,,,"Clean Energy, Energy, Energy Efficiency, Energy Management","Eindhoven, Noord-Brabant, The Netherlands",189
Loft Orbital,https://www.crunchbase.com/organization/loft-orbital-solutions-inc,Growing,Private,For Profit,501-1000,,Series B,2021-11-07,,2017-01-01,year,Active,Yes,,3,3,Early Stage Venture,140000000,USD,140000000,140000000,USD,140000000,Series B,156200000,USD,156200000,156200000,USD,156200000,"BlackRock, Alumni Ventures, MDI Ventures, Soundproof Ventures, Foundation Capital",21,"San Francisco Bay Area, West Coast, Western US","Hardware, Science and Engineering",$500M to $1B,,,,,"Aerospace, Satellite Communication","San Francisco, California, United States",1
The EVERY Company,https://www.crunchbase.com/organization/clara-foods,Growing,Private,For Profit,101-250,,Venture - Series Unknown,2023-02-01,,2015-01-01,year,Active,,,2,9,,,,,,,,Venture - Series Unknown,239750000,USD,239750000,239750000,USD,239750000,"IndieBio, UpHonest Capital, Prosus Ventures, SOSV, Main Sequence Ventures",31,"San Francisco Bay Area, West Coast, Western US","Biotechnology, Food and Beverage, Health Care, Manufacturing, Science and Engineering, Sustainability",$500M to $1B,,,,,"Biotechnology, Food and Beverage, Food Processing, Manufacturing, Nutrition, Sustainability","South San Francisco, California, United States",
