Pipo Saúde,https://www.crunchbase.com/organization/pipo-saúde,,Private,For Profit,251-500,,Venture - Series Unknown,2024-04-11,,2019-06-30,day,Active,Yes,,3,4,,,,,,,,Venture - Series Unknown,24600000,USD,24600000,24600000,USD,24600000,"Thrive Capital, Kaszek, FJ Labs, monashees, Atlantico",11,Latin America,Health Care,,,,,,Health Care,"São Paulo, Sao Paulo, Brazil",
Liquibase,https://www.crunchbase.com/organization/datical,Growing,Private,For Profit,11-50,,Series C,2019-02-28,,2012-01-01,year,Active,Yes,,3,8,Late Stage Venture,10000000,USD,10000000,10000000,USD,10000000,Series C,27014369,USD,27014369,27014369,USD,27014369,"Mercury, RC Capital, Austin Ventures, S3 Ventures, Mohr Davidow Ventures",9,Southern US,"Data and Analytics, Information Technology, Software",$50M to $100M,,,,,"Database, Developer Tools, Information Technology, Open Source, Software","Austin, Texas, United States",
ROAM,https://www.crunchbase.com/organization/roam-robotics,,Private,For Profit,11-50,,Series A,2018-11-29,,2012-01-01,year,Active,Yes,,3,2,Early Stage Venture,12000000,USD,12000000,12000000,USD,12000000,Series A,12000000,USD,12000000,12000000,USD,12000000,"Menlo Ventures, Boost VC, Valor Equity Partners, Spero Ventures, Yamaha Motor Ventures",8,"San Francisco Bay Area, West Coast, Western US","Hardware, Health Care, Science and Engineering, Software, Sports",$10M to $50M,,,,,"Fitness, Health Care, Medical, Medical Device, Robotics, Wellness","San Francisco, California, United States",
Job Today,https://www.crunchbase.com/organization/job-today,,Private,For Profit,11-50,,Non-equity Assistance,2021-05-01,,2015-01-01,year,Active,Yes,,2,4,Early Stage Venture,,,,16000000,USD,16000000,Series B,46000000,USD,46000000,46000000,USD,46000000,"Accel, Flint Capital, Mangrove Capital Partners, Felix Capital, Isomer Capital",10,"European Union (EU), Europe, Middle East, and Africa (EMEA)","Apps, Mobile, Professional Services, Software",,,,,,"Apps, Employment, Mobile","Luxembourg, Luxembourg, Luxembourg",
Confluera,https://www.crunchbase.com/organization/confluera,,Private,For Profit,11-50,Was Acquired,Series A,2020-05-19,,2018-06-18,day,Active,Yes,,3,3,M&A,20000000,USD,20000000,20000000,USD,20000000,Series A,29000000,USD,29000000,29000000,USD,29000000,"Lightspeed Venture Partners, Icon Ventures, Frank Slootman, Jon Soberg, Lane Bess",7,"San Francisco Bay Area, Silicon Valley, West Coast","Information Technology, Privacy and Security, Software",,,,,,"Cyber Security, Information Technology, Network Security, Security, Software","Palo Alto, California, United States",
Bustle Digital Group,https://www.crunchbase.com/organization/bustle,,Private,For Profit,251-500,Made Acquisitions,Venture - Series Unknown,2019-06-07,,2013-01-01,year,Active,Yes,,1,7,,30000000,USD,30000000,30000000,USD,30000000,Venture - Series Unknown,80500000,USD,80500000,80500000,USD,80500000,"General Catalyst, 500 Global, Google Ventures, Notable Capital, Social Capital",14,"Greater New York Area, East Coast, Northeastern US","Clothing and Apparel, Community and Lifestyle, Content and Publishing, Design, Media and Entertainment",,,,,,"Fashion, Lifestyle, Media and Entertainment, News","New York, New York, United States",
Kenjo,https://www.crunchbase.com/organization/kenjo,,Private,For Profit,51-100,,Series A,2023-09-17,,2019-01-01,year,Active,Yes,,4,3,Early Stage Venture,8800000,EUR,9387828,8800000,EUR,9387828,Series A,16587828,USD,16587828,16587828,USD,16587828,"redalpine, Hi Inov - Dentressangle, Lightbird, The Delta, Innovation Nest",5,"European Union (EU), Europe, Middle East, and Africa (EMEA)","Administrative Services, Artificial Intelligence (AI), Data and Analytics, Software",,,,,,"Human Resources, Predictive Analytics, Software","Berlin, Berlin, Germany",
Linear Labs,https://www.crunchbase.com/organization/linear-labs,Growing,Private,For Profit,11-50,,Series A,2022-03-02,,2014-01-01,year,Active,Yes,,2,8,Early Stage Venture,17000000,USD,17000000,17000000,USD,17000000,Series A,49800000,USD,49800000,119150000,USD,119150000,"Alumni Ventures, Science, Lowercarbon Capital, Capital Factory, Karman Ventures (fka Moving Capital)",21,"Dallas/Fort Worth Metroplex, Southern US","Consumer Electronics, Hardware, Manufacturing, Real Estate, Science and Engineering, Software, Transportation",,,,,,"Electronics, Heating, Ventilation, and Air Conditioning (HVAC), Manufacturing, Robotics, Transportation","Fort Worth, Texas, United States",
Fanatics,https://www.crunchbase.com/organization/fanatics,,Private,For Profit,10001+,"Made Acquisitions, Was Acquired",Private Equity,2022-12-06,,2002-01-01,year,Active,Yes,,6,11,M&A,700000000,USD,700000000,700000000,USD,700000000,Private Equity,4824999955,USD,4824999955,4899999955,USD,4899999955,"Fidelity, BlackRock, Alibaba Group, Bank of America, Andreessen Horowitz",27,"East Coast, Southern US","Commerce and Shopping, Manufacturing, Sports",,,,,,"eSports, Manufacturing, Retail, Sporting Goods, Sports","Jacksonville, Florida, United States",
PaymentCloud,https://www.crunchbase.com/organization/paymentcloud,Growing,Private,For Profit,51-100,"Made Acquisitions, Was Acquired",Debt Financing,2022-06-13,,2015-01-01,year,Active,Yes,,1,3,M&A,25000000,USD,25000000,10000000,USD,10000000,Corporate Round,10000000,USD,10000000,45000000,USD,45000000,"Espresso Capital, Electronic Merchant Systems",2,"Greater Los Angeles Area, West Coast, Western US","Commerce and Shopping, Financial Services, Lending and Investments, Payments, Software",,High,,,,"Credit, E-Commerce, Financial Services, Payments, Transaction Processing","Encino, California, United States",
Minna Technologies,https://www.crunchbase.com/organization/minna-technologies,Growing,Private,For Profit,51-100,,Series B,2021-01-14,,2016-05-30,day,Active,Yes,,3,3,Early Stage Venture,15500000,EUR,18833742,15500000,EUR,18833742,Series B,25264295,USD,25264295,25264295,USD,25264295,"Visa, Swedbank, 13books Capital, Middlegame Ventures, Zenith Venture Capital",6,"European Union (EU), Nordic Countries, Scandinavia","Financial Services, Lending and Investments",,,,,,"Banking, Financial Services, FinTech, Personal Finance","Gothenburg, Vastra Gotaland, Sweden",
Neurala,https://www.crunchbase.com/organization/neurala,Growing,Private,For Profit,11-50,,Venture - Series Unknown,2021-06-24,,2006-01-30,day,Active,Yes,,3,6,,12000000,USD,12000000,12000000,USD,12000000,Venture - Series Unknown,32078210,USD,32078210,32078210,USD,32078210,"Techstars, Pelion Venture Partners, ACME Capital, Right Side Capital Management, Draper Associates",19,"Greater Boston Area, East Coast, New England","Artificial Intelligence (AI), Consumer Electronics, Consumer Goods, Data and Analytics, Hardware, Science and Engineering, Software",$50M to $100M,High,,,,"Artificial Intelligence (AI), Drones, Machine Learning, Robotics, Software","Boston, Massachusetts, United States",
Circular,https://www.crunchbase.com/organization/circular-8ad4,,Private,For Profit,11-50,,Series A,2022-03-07,,2018-07-01,month,Active,Yes,,2,2,Early Stage Venture,7500000,USD,7500000,7500000,USD,7500000,Series A,10000000,USD,10000000,10000000,USD,10000000,"Kima Ventures, All Iron Ventures, Point Nine, LocalGlobe, Shilling",7,"European Union (EU), Europe, Middle East, and Africa (EMEA)","Administrative Services, Information Technology, Professional Services",,,,,,"Human Resources, Information Technology, Recruiting","Madrid, Madrid, Spain",
vidIQ,https://www.crunchbase.com/organization/vidiq,Growing,Private,For Profit,101-250,Made Acquisitions,Series A,2020-08-01,,2012-01-01,year,Active,Yes,,3,6,Early Stage Venture,3300000,USD,3300000,3300000,USD,3300000,Series A,7500000,USD,7500000,7500000,USD,7500000,"Techstars, Techstars Ventures, Social Starts, David Cohen, Lowercase Capital",14,"San Francisco Bay Area, West Coast, Western US","Advertising, Data and Analytics, Internet Services, Media and Entertainment, Sales and Marketing, Software, Video",,Medium,,,,"Advertising, Analytics, Brand Marketing, Content Creators, Marketing Automation, SEO, Video","San Francisco, California, United States",
Dig Inn,https://www.crunchbase.com/organization/dig-inn,Growing,Private,For Profit,501-1000,,Series F,2021-10-27,,1997-01-01,year,Active,Yes,,1,6,Late Stage Venture,65000000,USD,65000000,65000000,USD,65000000,Series F,136500000,USD,136500000,136500000,USD,136500000,"Monogram Capital Partners, Enlightened Hospitality Investments, Wexford Capital, Avalt, Union Square Hospitality Group",9,"Greater New York Area, East Coast, Northeastern US","Food and Beverage, Internet Services, Other, Professional Services",$100M to $500M,,,,,"Customer Service, Internet, Restaurants","New York, New York, United States",
SnapApp,https://www.crunchbase.com/organization/snapapp,,Private,For Profit,51-100,Was Acquired,Private Equity,2017-08-15,,2010-09-01,day,Closed,Yes,,1,2,M&A,10200000,USD,10200000,10200000,USD,10200000,Private Equity,22200000,USD,22200000,22200000,USD,22200000,"PSG Equity, Providence Equity Partners",2,"Greater Boston Area, East Coast, New England","Media and Entertainment, Other, Sales and Marketing, Software",$50M to $100M,,,,,"B2B, Content Creators, Content Marketing, Lead Generation, Marketing, Software","Boston, Massachusetts, United States",
Pythian,https://www.crunchbase.com/organization/pythian,,Private,For Profit,251-500,"Made Acquisitions, Was Acquired",Venture - Series Unknown,2017-05-03,,1997-09-08,day,Active,Yes,,2,2,M&A,15000000,USD,15000000,15000000,USD,15000000,Venture - Series Unknown,21000000,USD,21000000,21000000,USD,21000000,"RBC Capital, Business Development Bank of Canada, BDC Capital Corporation",3,Great Lakes,"Administrative Services, Artificial Intelligence (AI), Data and Analytics, Hardware, Information Technology, Other, Platforms, Professional Services, Software",,,,,,"Analytics, Big Data, Consulting, Data Center Automation, Hardware, Innovation Management, Operating Systems, Predictive Analytics, Project Management, Software","Ottawa, Ontario, Canada",
Trader Interactive,https://www.crunchbase.com/organization/trader-interactive,Growing,Private,For Profit,251-500,"Made Acquisitions, Was Acquired",Secondary Market,2021-05-12,,2017-01-01,year,Active,Yes,,,2,M&A,624000000,USD,624000000,,,,Private Equity,,,,624000000,USD,624000000,"Eurazeo, carsales",2,"East Coast, Southern US","Advertising, Commerce and Shopping, Sales and Marketing",,Medium,,,,"Advertising, E-Commerce, Marketing","Virginia Beach, Virginia, United States",
Movandi,https://www.crunchbase.com/organization/movandi,Growing,Private,For Profit,51-100,,Series C,2023-05-11,,2016-01-01,year,Active,Yes,,2,4,Late Stage Venture,,,,,,,Series C,56700000,USD,56700000,56700000,USD,56700000,"Alumni Ventures, Sierra Ventures, DNX Ventures, Celesta Capital, Cota Capital",8,"Greater Los Angeles Area, West Coast, Western US","Hardware, Internet Services, Mobile",,High,,,,"Internet, Mobile, Wireless","Irvine, California, United States",
Prelim,https://www.crunchbase.com/organization/original-tech,,Private,For Profit,11-50,,Venture - Series Unknown,2022-03-17,,2017-07-01,day,Active,Yes,,3,3,,2000000,USD,2000000,2000000,USD,2000000,Venture - Series Unknown,4120000,USD,4120000,4120000,USD,4120000,"Y Combinator, EJF Capital, Liquid 2 Ventures, Fuel Capital, Max Altman",7,"San Francisco Bay Area, West Coast, Western US","Financial Services, Lending and Investments",,,,,,"Banking, Financial Services, FinTech, Lending","San Francisco, California, United States",
ReadySet Surgical,https://www.crunchbase.com/organization/readyset-surgical,,Private,For Profit,11-50,,Venture - Series Unknown,2024-07-30,,2015-01-01,year,Active,Yes,,1,6,,3431719,USD,3431719,3431719,USD,3431719,Venture - Series Unknown,13093719,USD,13093719,13093719,USD,13093719,"JumpStart, CincyTech, Connetic Ventures, North Coast Ventures, Plymouth Growth",5,"Great Lakes, Midwestern US","Health Care, Information Technology, Internet Services, Software, Transportation",,,,,,"Cloud Data Services, Health Care, Hospital, Logistics, Medical Device, SaaS, Supply Chain Management","Cleveland, Ohio, United States",
PeopleGrove,https://www.crunchbase.com/organization/peoplegrove,Growing,Private,For Profit,51-100,"Made Acquisitions, Was Acquired",Venture - Series Unknown,2021-05-03,,2014-01-01,year,Active,Yes,,2,5,M&A,1664551,USD,1664551,1664551,USD,1664551,Venture - Series Unknown,8889551,USD,8889551,8889551,USD,8889551,"Reach Capital, Collaborative Fund, Floodgate, GSV Ventures, Dreamit Ventures",10,"San Francisco Bay Area, West Coast, Western US","Administrative Services, Community and Lifestyle, Education, Other, Professional Services",$10M to $50M,Medium,,,,"Alumni, Education, Higher Education, Human Resources, Professional Networking","San Francisco, California, United States",
Bulletproof,https://www.crunchbase.com/organization/bulletproof,,Private,For Profit,101-250,,Venture - Series Unknown,2020-09-15,,2014-01-01,year,Active,Yes,,1,5,,13000000,USD,13000000,13000000,USD,13000000,Venture - Series Unknown,83485000,USD,83485000,83485000,USD,83485000,"Trinity Ventures, CAVU Consumer Partners, Able Partners, Rocana Venture Partners, Beliv",5,"Greater Seattle Area, West Coast, Western US","Consumer Goods, Food and Beverage, Health Care, Information Technology, Privacy and Security, Travel and Tourism",,,,,,"Consumer Goods, Cyber Security, Dietary Supplements, Food and Beverage, Hospitality","Seattle, Washington, United States",
Intersection,https://www.crunchbase.com/organization/intersection-2,,Private,For Profit,501-1000,,Venture - Series Unknown,2017-11-07,,2015-01-01,year,Active,Yes,,3,1,,150000000,USD,150000000,150000000,USD,150000000,Venture - Series Unknown,150000000,USD,150000000,150000000,USD,150000000,"NewSpring, ArrowMark Partners, Graham Holdings",3,"Greater New York Area, East Coast, Northeastern US","Advertising, Media and Entertainment, Real Estate, Sales and Marketing",$100M to $500M,,,,,"Advertising, Digital Media, Media and Entertainment, Smart Cities","New York, New York, United States",
eTopus Technology,https://www.crunchbase.com/organization/etopus,Growing,Private,For Profit,11-50,,Series B,2024-07-10,,2013-01-01,year,Active,Yes,,2,3,Early Stage Venture,,,,,,,Series B,100000000,CNY,13717421,100000000,CNY,13717421,"Shang Qi Capital, Hua Capital, Lingang Science and Technology Venture Capital, ACTT, SK Telecom Americas Innopartners",6,"San Francisco Bay Area, Silicon Valley, West Coast","Consumer Electronics, Hardware, Information Technology, Science and Engineering",,,,,,"Electronics, Information Technology, Semiconductor","Sunnyvale, California, United States",
HighTower Advisors,https://www.crunchbase.com/organization/hightower-advisors,Growing,Private,For Profit,501-1000,Made Acquisitions,Private Equity,2020-12-03,Venture Capital,2008-01-01,year,Active,Yes,,2,6,Private Equity,,,,,,,Private Equity,300000000,USD,300000000,645000000,USD,645000000,"THL, PNC Bank, Asset Management Ventures (AMV), BMO Harris Bank, DLB Capital",5,"Greater Chicago Area, Great Lakes, Midwestern US",Financial Services,$500M to $1B,Medium,,,,"Finance, Financial Services, Wealth Management","Chicago, Illinois, United States",14
Rock Content,https://www.crunchbase.com/organization/rock-content,Growing,Private,For Profit,251-500,Made Acquisitions,Series B,2021-10-22,,2013-03-04,day,Active,Yes,,3,5,Early Stage Venture,30000000,USD,30000000,30000000,USD,30000000,Series B,34025000,USD,34025000,34025000,USD,34025000,"Google for Startups, BTG Pactual, Sun Moritz, Igah Ventures, First Ascent Ventures",12,"Greater Miami Area, East Coast, Southern US","Advertising, Internet Services, Professional Services, Sales and Marketing, Software",,Medium,,,,"Advertising, Content Marketing, Digital Marketing, Enterprise Software, Freelance, Internet, Marketing","Boca Raton, Florida, United States",
ForUsAll,https://www.crunchbase.com/organization/forus,Growing,Private,For Profit,11-50,,Debt Financing,2022-10-11,,2012-01-01,year,Active,Yes,,5,5,Early Stage Venture,5375000,USD,5375000,21000000,USD,21000000,Series B,33840000,USD,33840000,48851651,USD,48851651,"Ribbit Capital, Foundation Capital, Thirdstream Partners",3,"San Francisco Bay Area, West Coast, Western US","Community and Lifestyle, Financial Services, Other",$100M to $500M,,,,,"Financial Services, FinTech, Retirement, Small and Medium Businesses","San Francisco, California, United States",
Siemplify,https://www.crunchbase.com/organization/siemplify,,Private,For Profit,101-250,Was Acquired,Series C,2019-05-20,,2015-01-01,year,Active,Yes,,3,6,M&A,30000000,USD,30000000,30000000,USD,30000000,Series C,58000000,USD,58000000,58000000,USD,58000000,"Greylock, G20 Ventures, Georgian, 83North, Jump Capital",17,"Greater New York Area, East Coast, Northeastern US","Information Technology, Privacy and Security, Software",,,,,,"Cyber Security, Network Security, Security, Software","New York, New York, United States",
TerraTrue,https://www.crunchbase.com/organization/terratrue,,Private,For Profit,51-100,,Series A,2021-04-29,,2018-12-12,day,Active,Yes,,2,2,Early Stage Venture,15000000,USD,15000000,15000000,USD,15000000,Series A,19500000,USD,19500000,19500000,USD,19500000,"3L Capital, Bossanova Investimentos, Chris Sacca, overtime.vc",4,"San Francisco Bay Area, West Coast, Western US","Privacy and Security, Professional Services, Software",,,,,,"Compliance, Privacy, SaaS, Security, Software","San Francisco, California, United States",
InvGate,https://www.crunchbase.com/organization/invgate,Growing,Private,For Profit,251-500,,Private Equity,2023-07-12,,2009-01-01,day,Active,Yes,,2,1,Private Equity,35000000,USD,35000000,35000000,USD,35000000,Private Equity,35000000,USD,35000000,35000000,USD,35000000,"Riverwood Capital, Endeavor Catalyst",2,Latin America,"Financial Services, Information Technology, Software",,High,,,,"Asset Management, Enterprise Software, Information Technology, IT Management, Software","Buenos Aires, Distrito Federal, Argentina",
Artemis Health,https://www.crunchbase.com/organization/artemis-health-inc,,Private,For Profit,101-250,Was Acquired,Series C,2019-03-14,,2013-01-01,year,Active,Yes,,4,8,M&A,25000000,USD,25000000,25000000,USD,25000000,Series C,83020000,USD,83020000,83020000,USD,83020000,"Kickstart, F-Prime Capital, Bessemer Venture Partners, Eight Roads Ventures, Maverick Ventures",11,Western US,"Data and Analytics, Health Care, Information Technology, Media and Entertainment, Privacy and Security",,,,,,"Advice, Analytics, Electronic Health Record (EHR), Health Care, Information Services, Information Technology, Security","Salt Lake City, Utah, United States",
Turbonomic,https://www.crunchbase.com/organization/turbonomic,Growing,Private,For Profit,251-500,"Made Acquisitions, Was Acquired",Venture - Series Unknown,2019-02-07,,2008-01-01,year,Active,Yes,,5,6,M&A,,,,,,,Venture - Series Unknown,149500000,USD,149500000,149500000,USD,149500000,"Bain Capital, ICONIQ Growth, General Atlantic, Bain Capital Ventures, Globespan Capital Partners",7,"Greater Boston Area, East Coast, New England","Data and Analytics, Hardware, Information Technology, Internet Services, Software",,,,,,"Application Performance Management, Cloud Infrastructure, Enterprise Software, Information Technology, Productivity Tools, Software","Boston, Massachusetts, United States",
Body Vision Medical,https://www.crunchbase.com/organization/body-vision-medical,Growing,Private,For Profit,11-50,,Venture - Series Unknown,2020-06-03,,2014-01-01,year,Active,Yes,,1,4,,,,,,,,Venture - Series Unknown,28500000,USD,28500000,28500000,USD,28500000,"Champel Capital, FinRebel, Zohar Gilon, Romain Afflelou, Enlight Growth Partners",6,"Greater New York Area, East Coast, Northeastern US",Health Care,,,,,,"Health Care, Medical Device","New York, New York, United States",
AppFollow,https://www.crunchbase.com/organization/appfollow,Growing,Private,For Profit,51-100,,Series A,2020-10-29,,2015-01-01,year,Active,Yes,,3,7,Early Stage Venture,5000000,USD,5000000,5000000,USD,5000000,Series A,7263058,USD,7263058,7263058,USD,7263058,"Nauta Capital, RTP Global, s16vc, Internet Initiatives Development Fund (IIDF), Vendep Capital",8,"European Union (EU), Nordic Countries, Scandinavia","Apps, Data and Analytics, Mobile, Platforms, Software",,,,,,"Analytics, Android, iOS, Mobile, Mobile Apps, SaaS","Helsinki, Southern Finland, Finland",
Clari,https://www.crunchbase.com/organization/clari,Growing,Private,For Profit,501-1000,Made Acquisitions,Series F,2022-01-19,,2013-01-01,year,Active,Yes,,2,8,Late Stage Venture,225000000,USD,225000000,225000000,USD,225000000,Series F,496000000,USD,496000000,496000000,USD,496000000,"Silver Lake, Sequoia Capital, B Capital, Madrona, Blackstone Group",16,"San Francisco Bay Area, Silicon Valley, West Coast","Artificial Intelligence (AI), Data and Analytics, Information Technology, Sales and Marketing, Science and Engineering, Software",$1B to $10B,High,,,,"Analytics, Artificial Intelligence (AI), Business Information Systems, Enterprise Software, Productivity Tools, Sales Enablement","Sunnyvale, California, United States",
Mable,https://www.crunchbase.com/organization/mable-d9e3,,Private,For Profit,11-50,,Venture - Series Unknown,2024-07-09,,2019-01-01,year,Active,Yes,,1,4,,7000001,USD,7000001,7000001,USD,7000001,Venture - Series Unknown,24599997,USD,24599997,24599997,USD,24599997,"Venrock, Accomplice, Underscore VC, Founder Collective, Junction Venture Partners",9,"Greater Boston Area, East Coast, New England",Commerce and Shopping,,,,,,"E-Commerce, Wholesale","Boston, Massachusetts, United States",
Caltech,https://www.crunchbase.com/organization/caltech,,Private,,1001-5000,,Grant,2024-07-17,University Program,1891-01-01,year,Active,Yes,,1,3,,10000000,USD,10000000,,,,,,,,86511058,USD,86511058,"US Department of Energy, Alfred P. Sloan Foundation, Stewart Resnick, Lynda Resnick",4,"Greater Los Angeles Area, West Coast, Western US","Education, Other, Software",,,,,,"EdTech, Education, Universities","Pasadena, California, United States",8
Recurrent.ai,https://www.crunchbase.com/organization/recurrent-ai,Growing,Private,For Profit,51-100,,Venture - Series Unknown,2021-12-20,,2016-01-01,year,Active,Yes,,4,4,,38000000,USD,38000000,38000000,USD,38000000,Venture - Series Unknown,60000000,USD,60000000,60000000,USD,60000000,"Sequoia Capital China, Boyu Capital, ZhenFund, GSR Ventures, WestSummit Capital",9,Asia-Pacific (APAC),"Artificial Intelligence (AI), Data and Analytics, Sales and Marketing, Science and Engineering, Software",,High,,,,"Artificial Intelligence (AI), Machine Learning, SaaS, Sales, Software","Haidian, Beijing, China",
Xignite,https://www.crunchbase.com/organization/xignite,Growing,Private,For Profit,51-100,Was Acquired,Series C,2016-02-08,,2000-02-01,day,Active,Yes,,1,4,M&A,20500000,USD,20500000,20500000,USD,20500000,Series C,36919816,USD,36919816,37594816,USD,37594816,"Altos Ventures, QUICK, StarVest Partners, Startup Capital Ventures, Launny Steffens",6,"San Francisco Bay Area, Silicon Valley, West Coast","Financial Services, Hardware, Information Technology, Internet Services, Other, Software",$100M to $500M,Medium,,,,"Cloud Data Services, Cloud Infrastructure, Financial Services, FinTech, Information Services, Real Time, SaaS","San Mateo, California, United States",
Volterra,https://www.crunchbase.com/organization/volterra-inc,,Private,For Profit,11-50,"Made Acquisitions, Was Acquired",Venture - Series Unknown,2019-11-04,,2017-01-01,year,Active,Yes,,2,1,M&A,50000000,USD,50000000,50000000,USD,50000000,Venture - Series Unknown,50000000,USD,50000000,50000000,USD,50000000,"Khosla Ventures, M12 - Microsoft's Venture Fund, Mayfield Fund, Partech, Samsung NEXT",7,"San Francisco Bay Area, Silicon Valley, West Coast","Information Technology, Internet Services, Software",,,,,,"Cloud Data Services, Information Technology, Software","Santa Clara, California, United States",
Emarsys,https://www.crunchbase.com/organization/emarsys,Growing,Private,For Profit,501-1000,"Made Acquisitions, Was Acquired",Series B,2016-10-31,,2000-09-01,day,Active,Yes,,3,2,M&A,22300000,USD,22300000,22300000,USD,22300000,Series B,55300000,USD,55300000,55300000,USD,55300000,Vector Capital,1,"European Union (EU), Europe, Middle East, and Africa (EMEA)","Data and Analytics, Other, Sales and Marketing, Software",,,,,,"Analytics, B2C, Marketing Automation, SaaS, Software","Vienna, Wien, Austria",
Snoop,https://www.crunchbase.com/organization/snoop-09b7,,Private,For Profit,11-50,Was Acquired,Series A,2021-08-02,,2019-01-01,year,Active,Yes,,10,3,M&A,15000000,GBP,20837675,15000000,GBP,20837675,Series A,28200000,GBP,37702199,28200000,GBP,37702199,"Salesforce Ventures, Future Fund, Paulson & Co., Havisham Group, Lloyd Dorfman",5,"Europe, Middle East, and Africa (EMEA)","Apps, Financial Services, Mobile, Software",,,,,,"Financial Services, FinTech, InsurTech, Mobile Apps","London, England, United Kingdom",
Sandia National Laboratories,https://www.crunchbase.com/organization/sandia-national-laboratories,Growing,Private,For Profit,10001+,,Grant,2023-09-21,,1948-01-01,year,Active,Yes,,,5,,500000,USD,500000,,,,,,,,4400000,USD,4400000,"US Department of Energy, ARPA-E",2,Western US,"Government and Military, Information Technology",,High,,,,"Government, Information Technology, National Security","Albuquerque, New Mexico, United States",1
Parallel Wireless,https://www.crunchbase.com/organization/parallel-wireless,Growing,Private,For Profit,101-250,,Debt Financing,2016-02-25,,2012-01-01,year,Active,Yes,,4,2,Seed,8840000,USD,8840000,,,,Seed,,,,8840000,USD,8840000,"First Star Ventures, DN Capital",2,"East Coast, New England, Northeastern US","Hardware, Information Technology, Internet Services, Mobile, Privacy and Security",,Medium,,,,"Internet, Network Security, Telecommunications, Wireless","Nashua, New Hampshire, United States",
