Pizza Hut,https://www.crunchbase.com/organization/pizza-hut,Growing,Private,For Profit,10001+,Made Acquisitions,Debt Financing,2006-04-01,,1958-01-01,year,Active,Yes,,2,1,,,,,,,,,,,,,,,Banyan Mezzanine Funds,1,"Dallas/Fort Worth Metroplex, Southern US","Food and Beverage, Transportation, Travel and Tourism",,High,,,,"Food and Beverage, Food Delivery, Hospitality","Plano, Texas, United States",
Leverice,https://www.crunchbase.com/organization/leverice,,Private,For Profit,11-50,,Pre-Seed,2019-03-07,,2018-01-01,year,Active,Yes,,3,1,Seed,600000,USD,600000,600000,USD,600000,Pre-Seed,600000,USD,600000,600000,USD,600000,,,"San Francisco Bay Area, Silicon Valley, West Coast","Information Technology, Internet Services, Messaging and Telecommunications, Other, Software",,,,,,"B2B, Collaboration, Messaging, Productivity Tools, SaaS, Software","San Jose, California, United States",
Retention.com,https://www.crunchbase.com/organization/getemails,,Private,For Profit,11-50,,,,,2019-11-01,day,Active,Yes,,3,,,,,,,,,,,,,,,,,,Southern US,Software,,,,,,Software,"Austin, Texas, United States",
Husleie.no,https://www.crunchbase.com/organization/husleie-no,,Private,For Profit,11-50,,Venture - Series Unknown,2019-12-19,,2010-10-10,day,Active,Yes,,1,3,,,,,,,,Venture - Series Unknown,15000000,NOK,1904532,15000000,NOK,1904532,"Schibsted Growth, Oxer Kapital, Bjørn Ingier, Knut Stokke, Gustav Witzøe",5,"Nordic Countries, Scandinavia, Europe, Middle East, and Africa (EMEA)","Commerce and Shopping, Internet Services, Real Estate",,,,,,"Internet, Real Estate, Rental","Oslo, Oslo, Norway",
Blutag,https://www.crunchbase.com/organization/zumila,,Private,For Profit,1-10,,Seed,2021-01-08,,2018-04-01,month,Active,Yes,,1,3,Seed,2500000,USD,2500000,2500000,USD,2500000,Seed,4000000,USD,4000000,4000000,USD,4000000,"Techstars, Amazon Alexa Fund, Techstars Ventures, Industrious Ventures, Vulcan Capital",11,"Greater New York Area, East Coast, Northeastern US","Artificial Intelligence (AI), Commerce and Shopping, Hardware, Software",,,,,,"E-Commerce, Generative AI, Retail Technology, SaaS, Software","New York, New York, United States",
Join Marketing,https://www.crunchbase.com/organization/join-marketing,,Private,For Profit,11-50,,Venture - Series Unknown,2017-12-19,,2017-01-01,year,Active,Yes,,2,1,,1000000,EUR,1183722,1000000,EUR,1183722,Venture - Series Unknown,1000000,EUR,1183722,1000000,EUR,1183722,Airbridge Equity Partners,1,"European Union (EU), Europe, Middle East, and Africa (EMEA)","Advertising, Sales and Marketing",,,,,,"Advertising, Marketing","Haarlem, Noord-Holland, The Netherlands",
Megaputer Intelligence,https://www.crunchbase.com/organization/megaputer-intelligence-inc,Growing,Private,For Profit,101-250,,Debt Financing,2020-06-24,,1997-05-01,month,Active,Yes,,1,1,,150000,USD,150000,,,,,,,,150000,USD,150000,JP Morgan Chase,1,"Great Lakes, Midwestern US","Artificial Intelligence (AI), Data and Analytics, Design, Information Technology, Sales and Marketing, Software",,,,,,"Analytics, CRM, Data Mining, Data Visualization, Information Technology, Natural Language Processing, Predictive Analytics, Software","Bloomington, Indiana, United States",
slicedbread,https://www.crunchbase.com/organization/slicedbread,,Private,For Profit,11-50,,Series A,2018-10-03,,2011-01-01,year,Active,Yes,,2,1,Early Stage Venture,1000000,GBP,1294016,1000000,GBP,1294016,Series A,1000000,GBP,1294016,1000000,GBP,1294016,Sussex Place Ventures,1,"Europe, Middle East, and Africa (EMEA)","Information Technology, Software",,,,,,"Information Services, Information Technology, Software","Altrincham, Cheshire, United Kingdom",
Invitel Holdings,https://www.crunchbase.com/organization/invitel-holdings,,Private,For Profit,501-1000,"Made Acquisitions, Was Acquired",Grant,2016-09-28,,1992-01-01,year,Active,Yes,,,1,M&A,6350000,EUR,7128424,,,,,,,,6350000,EUR,7128424,European Union,1,"European Union (EU), Europe, Middle East, and Africa (EMEA)","Hardware, Sales and Marketing",,,,,,"Public Relations, Telecommunications","Budaörs, Pest, Hungary",
Retargetly,https://www.crunchbase.com/organization/retargetly,,Private,For Profit,11-50,Was Acquired,Seed,2016-01-01,,2014-01-01,year,Active,Yes,,3,3,M&A,120000,USD,120000,120000,USD,120000,Seed,145000,USD,145000,185000,USD,185000,"NXTP Ventures, Start-Up Chile",2,Latin America,"Advertising, Data and Analytics, Information Technology, Media and Entertainment, Sales and Marketing, Software",,,,,,"Ad Targeting, Advertising Platforms, Big Data, Brand Marketing, Data Integration, Data Management, Digital Media","Buenos Aires, Distrito Federal, Argentina",
Talenta,https://www.crunchbase.com/organization/talenta,,Private,For Profit,101-250,Was Acquired,Seed,2016-08-08,,2014-01-01,year,Active,Yes,,1,4,M&A,,,,,,,Seed,,,,50000,USD,50000,"East Ventures, Pegasus Tech Ventures, Skystar Capital, Google Launchpad Accelerator",4,"Asia-Pacific (APAC), Association of Southeast Asian Nations (ASEAN), Southeast Asia","Administrative Services, Professional Services, Software",,,,,,"Human Resources, Recruiting, SaaS, Software","Jakarta, Jakarta Raya, Indonesia",
Riveron,https://www.crunchbase.com/organization/riveron-consulting,Stable,Private,For Profit,501-1000,"Made Acquisitions, Was Acquired",Private Equity,2019-05-17,,2006-01-01,year,Active,Yes,,1,1,M&A,,,,,,,Private Equity,,,,,,,H.I.G. Capital,1,"Dallas/Fort Worth Metroplex, Southern US","Financial Services, Professional Services",,Low,,,,"Consulting, Financial Services","Dallas, Texas, United States",
SmartTab,https://www.crunchbase.com/organization/veloce-corporation,,Private,For Profit,11-50,,Non-equity Assistance,2021-12-08,,2015-01-01,year,Active,Yes,,1,3,Seed,,,,2200000,USD,2200000,Angel,2200000,USD,2200000,2200000,USD,2200000,"PharmStars, StartUp Health",2,"Greater Denver Area, Western US","Consumer Electronics, Hardware, Health Care, Mobile",,,,,,"Electronics, Health Care, Wireless","Denver, Colorado, United States",
ParkMobile,https://www.crunchbase.com/organization/parkmobile,,Private,For Profit,101-250,Was Acquired,Venture - Series Unknown,2016-06-20,,2008-01-01,year,Active,Yes,,1,3,M&A,,,,,,,Venture - Series Unknown,6300000,USD,6300000,6300000,USD,6300000,"Bayerische Motoren Werke, Fontinalis Partners, Bluefield Investments",3,"Greater Atlanta Area, East Coast, Southern US","Apps, Financial Services, Mobile, Other, Payments, Software, Transportation",,,,,,"Mobile, Mobile Apps, Mobile Payments, Parking, Service Industry, Software","Atlanta, Georgia, United States",
Shared Medical Services,https://www.crunchbase.com/organization/shared-medical-systems,,Private,For Profit,251-500,,Venture - Series Unknown,2024-01-05,,1980-01-01,year,Active,Yes,,1,1,,100000,USD,100000,100000,USD,100000,Venture - Series Unknown,100000,USD,100000,100000,USD,100000,,,"Great Lakes, Midwestern US","Biotechnology, Health Care, Information Technology, Science and Engineering",,,,,,"Biotechnology, Health Care, Health Diagnostics, Hospital, Information Technology","Cottage Grove, Wisconsin, United States",
DoStuff Media,https://www.crunchbase.com/organization/dostuff-media,,Private,For Profit,11-50,,Venture - Series Unknown,2014-10-27,,2010-01-01,year,Active,Yes,,4,1,,372500,USD,372500,372500,USD,372500,Venture - Series Unknown,372500,USD,372500,372500,USD,372500,,,Southern US,"Community and Lifestyle, Events, Food and Beverage, Media and Entertainment, Sales and Marketing, Travel and Tourism",,,,,,"Communities, Content, Digital Media, Events, Food and Beverage, Guides, Local, Travel","Austin, Texas, United States",
OneDome,https://www.crunchbase.com/organization/onedome,,Private,For Profit,51-100,Made Acquisitions,Series B,2022-10-27,,2016-04-11,day,Active,Yes,,1,5,Early Stage Venture,10000000,GBP,11563996,10000000,GBP,11563996,Series B,23249999,GBP,28774629,23249999,GBP,28774629,"The Future Fund, Nour Nouf, Lord David Alliance, David Giampaolo, Martin Bolland",11,"Europe, Middle East, and Africa (EMEA)","Commerce and Shopping, Financial Services, Real Estate",,,,,,"FinTech, Marketplace, Real Estate","London, England, United Kingdom",
CUBE,https://www.crunchbase.com/organization/cube-global,,Private,For Profit,101-250,Made Acquisitions,Private Equity,2024-03-20,,2011-12-19,day,Active,Yes,,1,2,Private Equity,,,,,,,Private Equity,,,,,,,"Hg, Bregal Milestone",2,"Europe, Middle East, and Africa (EMEA)","Artificial Intelligence (AI), Data and Analytics, Financial Services, Information Technology, Professional Services, Science and Engineering, Software",,,,,,"Artificial Intelligence (AI), Compliance, Financial Services, FinTech, Information Technology, Machine Learning, Risk Management","London, England, United Kingdom",
Hwy Haul,https://www.crunchbase.com/organization/hwy-haul,,Private,For Profit,51-100,,Venture - Series Unknown,2022-11-09,,2018-10-08,day,Active,Yes,,3,6,,10000000,USD,10000000,10000000,USD,10000000,Venture - Series Unknown,23000000,USD,23000000,23000000,USD,23000000,"AgFunder, Eileses Capital, BluePointe Ventures, Thunder Future, True Blue Partners",6,"San Francisco Bay Area, Silicon Valley, West Coast",Transportation,,,,,,"Freight Service, Logistics, Shipping, Supply Chain Management, Transportation","Santa Clara, California, United States",
LogicHub,https://www.crunchbase.com/organization/logichub,,Private,For Profit,51-100,Was Acquired,Series A,2017-02-01,,2016-02-01,month,Active,Yes,,2,1,M&A,8400000,USD,8400000,8400000,USD,8400000,Series A,8400000,USD,8400000,8400000,USD,8400000,"Nexus Venture Partners, Storm Ventures",2,"San Francisco Bay Area, Silicon Valley, West Coast","Artificial Intelligence (AI), Data and Analytics, Information Technology, Privacy and Security, Science and Engineering, Software",$10M to $50M,,,,,"Artificial Intelligence (AI), Cyber Security, Network Security, SaaS, Security","Mountain View, California, United States",
WhoZaGood,https://www.crunchbase.com/organization/whozagood,,Private,For Profit,1-10,,Angel,2017-09-20,,2010-01-01,year,Active,Yes,,1,2,Seed,4000000,CAD,3240375,4000000,CAD,3240375,Angel,3335375,USD,3335375,3335375,USD,3335375,,,,"Community and Lifestyle, Internet Services",,,,,,"Q&A, Search Engine","Calgary, Alberta, Canada",
UFT,https://www.crunchbase.com/organization/kussbus,,Private,For Profit,11-50,,Seed,2019-11-01,,2016-01-01,year,Active,Yes,,2,2,Seed,500000,EUR,558412,500000,EUR,558412,Seed,2300000,EUR,2636996,2300000,EUR,2636996,,,"European Union (EU), Europe, Middle East, and Africa (EMEA)","Apps, Mobile, Software, Transportation, Travel and Tourism",,,,,,"Enterprise Software, Mobile Apps, Public Transportation, Ride Sharing, SaaS, Software, Transportation, Travel","Luxembourg, Luxembourg, Luxembourg",
Data Enlighten,https://www.crunchbase.com/organization/data-enlighten,,Private,For Profit,51-100,,Series A,2018-10-25,,2015-09-01,month,Active,Yes,,2,1,Early Stage Venture,14396775,USD,14396775,14396775,USD,14396775,Series A,14396775,USD,14396775,14396775,USD,14396775,"Ant Group, Didi, YF Capital",3,Asia-Pacific (APAC),Transportation,,,,,,"Space Travel, Transportation","Beijing, Beijing, China",
Action Behavior Centers,https://www.crunchbase.com/organization/action-behavior-centers,,Private,For Profit,5001-10000,Was Acquired,Debt Financing,2023-06-01,,2017-03-01,month,Active,Yes,,2,1,M&A,,,,,,,,,,,,,,Churchill Asset Management,1,Southern US,Health Care,,,,,,Health Care,"Austin, Texas, United States",
Resource Data,https://www.crunchbase.com/organization/resource-data,,Private,For Profit,101-250,,Venture - Series Unknown,2020-01-01,,1986-01-01,year,Active,Yes,,1,6,,325702,USD,325702,325702,USD,325702,Venture - Series Unknown,1300078,USD,1300078,1300078,USD,1300078,,,Western US,"Data and Analytics, Information Technology, Professional Services, Software",,,,,,"Consulting, Database, Enterprise Software, Information Technology, Software","Anchorage, Alaska, United States",
Apurata,https://www.crunchbase.com/organization/apurata,,Private,For Profit,1-10,,Seed,2019-08-19,,2016-01-01,year,Active,Yes,,2,2,Seed,150000,USD,150000,150000,USD,150000,Seed,150000,USD,150000,150000,USD,150000,"Y Combinator, 500 Global",2,Latin America,"Financial Services, Internet Services",,,,,,"Financial Services, FinTech, Internet","Lima, Lima, Peru",
Businessolver,https://www.crunchbase.com/organization/businessolver,Growing,Private,For Profit,501-1000,"Made Acquisitions, Was Acquired",Private Equity,2018-01-01,,1998-01-01,year,Active,Yes,,2,2,M&A,,,,,,,Private Equity,65157943,USD,65157943,65157943,USD,65157943,Warburg Pincus,1,Midwestern US,"Financial Services, Information Technology, Professional Services",,,,,,"Accounting, Financial Services, Information Technology","West Des Moines, Iowa, United States",
CAVEWIRE,https://www.crunchbase.com/organization/cavewire,,Private,For Profit,1-10,,Grant,2016-10-27,,2014-01-01,year,Active,Yes,,2,2,Seed,466000,USD,466000,400000,USD,400000,Seed,400000,USD,400000,866000,USD,866000,,,"San Francisco Bay Area, West Coast, Western US","Consumer Electronics, Hardware, Internet Services, Software",,,,,,"Computer, Internet, Software","San Francisco, California, United States",
Wealthminder,https://www.crunchbase.com/organization/wealthminder,,Private,For Profit,1001-5000,Was Acquired,Series A,2016-05-26,,2013-01-01,year,Active,Yes,,2,3,M&A,425000,USD,425000,425000,USD,425000,Series A,1875000,USD,1875000,2130529,USD,2130529,"Green Visor Capital, Signatures Capital",2,"Washington DC Metro Area, East Coast, Southern US","Financial Services, Professional Services, Software",,,,,,"Finance, Financial Services, FinTech, Risk Management, Software, Wealth Management","Reston, Virginia, United States",
Streak,https://www.crunchbase.com/organization/streak,,Private,For Profit,11-50,,Convertible Note,2012-10-16,,2011-01-01,year,Active,Yes,,2,3,Seed,1900000,USD,1900000,,,,Seed,,,,1900000,USD,1900000,"Y Combinator, BoxGroup, Battery Ventures, Floodgate, Initialized Capital",12,"San Francisco Bay Area, West Coast, Western US","Information Technology, Internet Services, Messaging and Telecommunications, Platforms, Sales and Marketing, Software",,,,,,"CRM, Email, Google, SaaS, Sales Automation","San Francisco, California, United States",
Nudgespot,https://www.crunchbase.com/organization/nudgespot,,Private,For Profit,1-10,Was Acquired,Seed,2015-05-21,,2014-11-01,month,Closed,Yes,,4,1,M&A,650000,USD,650000,650000,USD,650000,Seed,650000,USD,650000,650000,USD,650000,"Kae Capital, Anoop Goyal, Mike Shah, V.A. Sastry",4,Asia-Pacific (APAC),"Information Technology, Internet Services, Messaging and Telecommunications, Mobile, Other, Platforms, Professional Services, Sales and Marketing, Software",,,,,,"Customer Service, Email Marketing, Information Technology, iOS, Marketing Automation, Messaging, Mobile","Bangalore, Karnataka, India",
Goshen Health,https://www.crunchbase.com/organization/goshen-health,,Private,For Profit,1001-5000,,Grant,2018-04-27,,1901-01-01,year,Active,Yes,,,1,,350000,USD,350000,,,,,,,,350000,USD,350000,,,"Great Lakes, Midwestern US",Health Care,,,,,,"Health Care, Hospital","Goshen, Indiana, United States",
GEICO,https://www.crunchbase.com/organization/geico,,Private,For Profit,10001+,Was Acquired,,,,1936-01-01,year,Active,Yes,,2,,M&A,,,,,,,,,,,,,,,,"Greater Baltimore-Maryland Area, East Coast, Southern US","Financial Services, Government and Military, Internet Services, Mobile",,,,,,"Auto Insurance, Financial Services, Government, Insurance, Internet, Mobile","Chase, Maryland, United States",
Bob's Discount Furniture,https://www.crunchbase.com/organization/bob-s-discount-furniture,Growing,Private,For Profit,1001-5000,Was Acquired,,,,1991-01-01,year,Active,Yes,,2,,M&A,,,,,,,,,,,,,,,,"East Coast, New England, Northeastern US","Consumer Goods, Real Estate",,Medium,,,,"Furniture, Home Decor","Manchester, Connecticut, United States",
Adaptiva,https://www.crunchbase.com/organization/adaptiva,,Private,For Profit,11-50,,,,,2004-01-01,year,Active,Yes,,1,,,,,,,,,,,,,,,,,,"Greater Seattle Area, West Coast, Western US",Software,,,,,,Software,"Bellevue, Washington, United States",
County of San Mateo,https://www.crunchbase.com/organization/county-of-san-mateo,Growing,Private,Non-profit,5001-10000,,Grant,2023-06-28,,1856-04-01,month,Active,Yes,,,1,,404400,USD,404400,,,,,,,,404400,USD,404400,California State Coastal Conservancy,1,"San Francisco Bay Area, Silicon Valley, West Coast","Government and Military, Health Care, Other, Social Impact",,,,,,"Association, Government, Health Care, Non Profit","Redwood City, California, United States",
ToothPic,https://www.crunchbase.com/organization/toothpic,,Private,For Profit,1-10,,Seed,2021-01-19,,2016-12-06,day,Active,Yes,,1,2,Seed,810000,EUR,983306,810000,EUR,983306,Seed,1110000,EUR,1349588,1110000,EUR,1349588,"Club degli Investitori, Vertis Venture 3 Tech Transfer",2,"European Union (EU), Europe, Middle East, and Africa (EMEA)","Data and Analytics, Information Technology, Privacy and Security, Software",,,,,,"Cyber Security, Image Recognition, Information Technology, Software","Torino, Piemonte, Italy",
Molecular Health,https://www.crunchbase.com/organization/molecularhealth,,Private,For Profit,101-250,,Private Equity,2015-11-16,,2004-01-01,year,Active,Yes,,1,1,Private Equity,25000000,EUR,26712712,25000000,EUR,26712712,Private Equity,25000000,EUR,26712712,25000000,EUR,26712712,dievini Hopp Biotech Holding,1,"European Union (EU), Europe, Middle East, and Africa (EMEA)","Biotechnology, Health Care, Information Technology, Science and Engineering",,,,,,"Biotechnology, Health Care, Health Diagnostics, Information Technology, Medical","Heidelberg, Baden-Wurttemberg, Germany",
mylivn,https://www.crunchbase.com/organization/mylivn,,Private,For Profit,1-10,,Seed,2021-05-10,,2015-01-01,year,Active,Yes,,1,5,Seed,2000000,EUR,2428101,2000000,EUR,2428101,Seed,9500000,EUR,10994897,9500000,EUR,10994897,,,"European Union (EU), Europe, Middle East, and Africa (EMEA)","Apps, Content and Publishing, Internet Services, Media and Entertainment, Software",,,,,,"Apps, Blogging Platforms, Social Media, Social Network","Munich, Bayern, Germany",
Aya Healthcare,https://www.crunchbase.com/organization/aya-healthcare,Growing,Private,For Profit,5001-10000,Made Acquisitions,,,,1951-01-01,year,Active,Yes,,1,,,,,,,,,,,,,,,,,,"Greater San Diego Area, West Coast, Western US","Health Care, Travel and Tourism",,Medium,,,,"Health Care, Hospitality, Travel","San Diego, California, United States",
Ginger Labs,https://www.crunchbase.com/organization/ginger-labs,,Private,For Profit,11-50,,,,,2008-11-01,month,Active,Yes,,1,,,,,,,,,,,,,,,,,,"San Francisco Bay Area, West Coast, Western US",Software,,,,,,"Productivity Tools, Software","San Francisco, California, United States",
BlueCat,https://www.crunchbase.com/organization/bluecat-networks,Growing,Private,For Profit,251-500,"Made Acquisitions, Was Acquired",Secondary Market,2022-06-23,,2001-12-01,day,Active,Yes,,2,3,M&A,,,,16800000,USD,16800000,Series B,27800000,USD,27800000,27800000,USD,27800000,"Trident Capital, Audax Private Equity, Bridgescale Partners, TD Capital",4,Great Lakes,"Apps, Consumer Electronics, Hardware, Information Technology, Internet Services, Mobile, Privacy and Security, Software",,,,,,"Apps, Cloud Computing, Computer, Enterprise Software, Mobile Devices, Network Security, Virtualization","Toronto, Ontario, Canada",
Acturis,https://www.crunchbase.com/organization/acturis,Growing,Private,For Profit,501-1000,"Made Acquisitions, Was Acquired",Private Equity,2019-03-01,,2000-01-01,year,Active,Yes,,2,3,M&A,,,,,,,Private Equity,,,,,,,"Summit Partners, Astorg, Future Fifty",3,"Europe, Middle East, and Africa (EMEA)","Financial Services, Software",,,,,,"Insurance, SaaS, Software","London, England, United Kingdom",
Science Center,https://www.crunchbase.com/organization/science-center,,Private,Non-profit,101-250,,Grant,2023-10-18,University Program,1963-01-01,year,Active,Yes,,1,6,,250000,USD,250000,,,,,,,,3043425,USD,3043425,"US Department of Commerce, Economic Development Administation, National Institute on Aging, Office of Naval Research, Pennsylvania department of education",4,"Greater Philadelphia Area, Great Lakes, Northeastern US","Education, Financial Services, Lending and Investments, Other, Professional Services, Social Impact",,,,,,"Education, Incubators, Innovation Management, Non Profit, Universities","Philadelphia, Pennsylvania, United States",14
EasyServ,https://www.crunchbase.com/organization/easyserv,,Private,For Profit,1-10,,Venture - Series Unknown,2019-04-03,,2014-01-01,year,Active,Yes,,2,2,,5100000,SEK,550785,5100000,SEK,550785,Venture - Series Unknown,5100000,SEK,550785,5100000,SEK,550785,"Almi Invest, Nicolas Hassbjer",2,"European Union (EU), Nordic Countries, Scandinavia","Other, Software",,,,,,"Developer Tools, Enterprise Software, Service Industry","Halmstad, Hallands Lan, Sweden",
END.,https://www.crunchbase.com/organization/end-c23b,,Private,For Profit,501-1000,Was Acquired,Venture - Series Unknown,2014-01-01,,2005-01-01,year,Active,Yes,,2,1,M&A,,,,,,,Venture - Series Unknown,,,,,,,Index Ventures,1,"Europe, Middle East, and Africa (EMEA)","Clothing and Apparel, Commerce and Shopping, Design, Internet Services",,,,,,"Apparel, E-Commerce, Fashion, Internet, Retail","Newcastle Upon Tyne, Newcastle upon Tyne, United Kingdom",
Notey Labs,https://www.crunchbase.com/organization/notey,,Private,For Profit,1-10,,Seed,2015-02-17,,2014-01-01,year,Active,Yes,,2,2,Seed,1600000,USD,1600000,1600000,USD,1600000,Seed,1600000,USD,1600000,1600000,USD,1600000,"VentureSouq, Ryan Holmes, Empiricus Capital, Steve Kirsch, VPG Asia",5,Asia-Pacific (APAC),"Internet Services, Media and Entertainment, Software",,,,,,"Digital Media, Internet, Software","Causeway Bay, Hong Kong Island, Hong Kong",
Loctio,https://www.crunchbase.com/organization/loctio,,Private,For Profit,1-10,,Seed,2020-03-19,,2019-06-26,day,Active,Yes,,1,1,Seed,500000,EUR,532758,500000,EUR,532758,Seed,500000,EUR,532758,500000,EUR,532758,Metavallon VC,1,"European Union (EU), Europe, Middle East, and Africa (EMEA)","Artificial Intelligence (AI), Data and Analytics, Information Technology, Software",,,,,,"Information Technology, Machine Learning, Software","Aegaleo, Attiki, Greece",
Nubo Software,https://www.crunchbase.com/organization/nubo-software,,Private,For Profit,11-50,,Series A,2016-01-21,,2011-07-14,day,Active,Yes,,1,1,Early Stage Venture,7000000,USD,7000000,7000000,USD,7000000,Series A,7000000,USD,7000000,7000000,USD,7000000,"Magma Venture Partners, Motorola Solutions Venture Capital",2,"Europe, Middle East, and Africa (EMEA), Middle East, Middle East and North Africa (MENA)","Mobile, Other, Software",,,,,,"Enterprise Software, Infrastructure, Mobile, Software","Lod, HaMerkaz, Israel",
Waygo Visual Translator,https://www.crunchbase.com/organization/waygo-visual-translator,,Private,For Profit,1-10,,Non-equity Assistance,2016-02-17,,2011-01-01,year,Active,Yes,,,3,Seed,,,,750000,USD,750000,Seed,1650000,USD,1650000,1650000,USD,1650000,"500 Global, East Ventures, Golden Gate Ventures, Presence Capital, AngelVest",7,"San Francisco Bay Area, Silicon Valley, West Coast","Apps, Information Technology, Internet Services, Mobile, Software",,,,,,"Information Services, Mobile, Mobile Apps, Product Search","Mountain View, California, United States",
Northern Health,https://www.crunchbase.com/organization/northern-health,,Private,For Profit,10001+,,Grant,2024-06-26,,2001-01-01,year,Active,Yes,,,1,,125000,CAD,91208,,,,,,,,125000,CAD,91208,Public Health Agency of Canada,1,Southern US,Health Care,,,,,,"Health Care, Health Diagnostics, Medical, Mental Health","Canada, Kentucky, United States",
Idera,https://www.crunchbase.com/organization/idera-inc,,Private,For Profit,501-1000,"Made Acquisitions, Was Acquired",Private Equity,2019-05-23,,2000-01-01,year,Active,Yes,,1,1,M&A,,,,,,,Private Equity,,,,,,,"Partners Group, TA Associates, HGGC",3,"Greater Houston Area, Southern US","Other, Software",,,,,,"B2B, Software","Houston, Texas, United States",
HandUp PBC,https://www.crunchbase.com/organization/handup-pbc,,Private,Non-profit,1-10,Was Acquired,Seed,2016-06-30,,2013-06-18,day,Active,Yes,,3,5,M&A,,,,,,,Seed,1070000,USD,1070000,1070000,USD,1070000,"Third Sphere, Precursor Ventures, SV Angel, Version One Ventures, Impact America Fund",9,"San Francisco Bay Area, West Coast, Western US","Commerce and Shopping, Financial Services, Mobile, Other, Payments, Social Impact, Software",,,,,,"Crowdfunding, E-Commerce, Homeless Shelter, Mobile Payments, Non Profit","San Francisco, California, United States",
Piab Group Holding,https://www.crunchbase.com/organization/piab-group-holding,,Private,For Profit,501-1000,"Made Acquisitions, Was Acquired",,,,1951-01-01,year,Active,Yes,,1,,M&A,,,,,,,,,,,,,,,,"European Union (EU), Nordic Countries, Scandinavia","Commerce and Shopping, Manufacturing, Science and Engineering",,,,,,"E-Commerce, Industrial Automation, Machinery Manufacturing","Täby, Uppsala Lan, Sweden",
CargoTech,https://www.crunchbase.com/organization/cargotech,Growing,Private,For Profit,11-50,,Seed,2020-10-01,,2016-01-01,year,Active,Yes,,1,1,Seed,2500000,USD,2500000,2500000,USD,2500000,Seed,2500000,USD,2500000,2500000,USD,2500000,,,"Europe, Middle East, and Africa (EMEA)","Commerce and Shopping, Transportation",,,,,,"E-Commerce, Retail, Transportation","Varshavskiy, Chelyabinsk, Russian Federation",
Queritel.com,https://www.crunchbase.com/organization/queritel-com,,Private,For Profit,11-50,,Grant,2024-02-08,,2016-12-15,day,Active,Yes,,2,4,,25000,USD,25000,,,,,,,,105000,USD,105000,"Start-Up Chile, VentureOut, Parallel18, Greater St. Louis, Inc.",4,Latin America,"Artificial Intelligence (AI), Data and Analytics, Design, Other, Professional Services, Science and Engineering, Software",,,,,,"Analytics, Artificial Intelligence (AI), Crowdsourcing, Freelance, Market Research, SaaS","Las Condes, Region Metropolitana, Chile",
