ReSpo.Vision,https://www.crunchbase.com/organization/respo-vision,,Private,For Profit,11-50,,Grant,2021-12-01,,2020-01-01,year,Active,Yes,,4,2,Seed,1800000,USD,1800000,1200000,USD,1200000,Pre-Seed,1200000,USD,1200000,3000000,USD,3000000,"ff Venture Capital, National Center for Research & Development, RKKVC",3,"European Union (EU), Europe, Middle East, and Africa (EMEA)","Artificial Intelligence (AI), Data and Analytics, Hardware, Software, Sports",,,,,,"Computer Vision, Machine Learning, Sports","Warsaw, Mazowieckie, Poland",
Shipsi,https://www.crunchbase.com/organization/shipsi-inc,,Private,For Profit,11-50,,Seed,2021-02-24,,2017-01-01,year,Active,Yes,,2,7,Seed,,,,,,,Seed,2820000,USD,2820000,2820000,USD,2820000,"Techstars, EXPERT DOJO, Precursor Ventures, Initial Capital, Halogen Ventures",9,Southern US,"Administrative Services, Commerce and Shopping, Hardware, Information Technology, Software, Transportation",$1M to $10M,,,,,"Delivery, E-Commerce, Information Technology, Logistics, Retail, Retail Technology, Same Day Delivery, Shipping, Supply Chain Management","Austin, Texas, United States",
Covered Insurance,https://www.crunchbase.com/organization/covered-2,,Private,For Profit,1-10,,Corporate Round,2020-02-25,,2016-01-01,year,Active,Yes,,1,4,,,,,,,,Corporate Round,700000,USD,700000,700000,USD,700000,"Radian Group, Moderne Ventures, K50 Ventures, Constance Freedman, Ozmen Ventures",5,"Greater Denver Area, Western US","Commerce and Shopping, Financial Services, Real Estate",$1M to $10M,,,,,"Finance, Financial Services, Insurance, Marketplace, PropTech","Denver, Colorado, United States",
Scalarr,https://www.crunchbase.com/organization/scalarr,,Private,For Profit,11-50,,Series A,2021-02-11,,2016-11-20,day,Active,Yes,,2,2,Early Stage Venture,7500000,USD,7500000,7500000,USD,7500000,Series A,7500000,USD,7500000,7500000,USD,7500000,"TMT Investments, Speedinvest, OTB Ventures, EBRD Venture Capital",4,"East Coast, Southern US","Advertising, Artificial Intelligence (AI), Data and Analytics, Financial Services, Information Technology, Payments, Privacy and Security, Sales and Marketing, Science and Engineering, Software",,,,,,"Analytics, Artificial Intelligence (AI), Big Data, Cyber Security, Fraud Detection, Machine Learning, Mobile Advertising, Security, Software","Dover, Delaware, United States",
Qihan Biotech,https://www.crunchbase.com/organization/qihan-biotech,,Private,For Profit,101-250,,Series B,2023-09-22,,2017-01-01,year,Active,Yes,,1,4,Early Stage Venture,16000000,USD,16000000,16000000,USD,16000000,Series B,116300000,USD,116300000,116300000,USD,116300000,"Sequoia Capital China, Matrix Partners China, Northern Light Venture Capital, CMB International Capital Corporation, Lilly Asia Ventures",13,Asia-Pacific (APAC),"Biotechnology, Health Care, Science and Engineering",,,,,,"Biotechnology, Clinical Trials, Health Care, Medical, Medical Device","Hangzhou, Zhejiang, China",
Replicant,https://www.crunchbase.com/organization/replicant-inc,,Private,For Profit,101-250,,Series B,2022-04-26,,2017-01-01,year,Active,Yes,,4,4,Early Stage Venture,78000000,USD,78000000,78000000,USD,78000000,Series B,113000000,USD,113000000,113000000,USD,113000000,"Alumni Ventures, Bloomberg Beta, Costanoa Ventures, Stripes, Salesforce Ventures",11,"San Francisco Bay Area, West Coast, Western US","Artificial Intelligence (AI), Data and Analytics, Hardware, Information Technology, Science and Engineering, Software",,,,,,"Artificial Intelligence (AI), Data Center Automation, Information Services, Information Technology, Machine Learning, Software","San Francisco, California, United States",
Axoni,https://www.crunchbase.com/organization/axoni,Growing,Private,For Profit,101-250,,Venture - Series Unknown,2023-04-26,,2017-01-01,year,Active,Yes,,2,5,,20000000,USD,20000000,20000000,USD,20000000,Venture - Series Unknown,109774999,USD,109774999,109774999,USD,109774999,"Citi, UBS, HSBC, JP Morgan Chase, Andreessen Horowitz",29,"Greater New York Area, East Coast, Northeastern US","Financial Services, Software",$100M to $500M,,,,,"Financial Services, FinTech, Software","New York, New York, United States",
CoScreen,https://www.crunchbase.com/organization/coscreen,,Private,For Profit,11-50,Was Acquired,Seed,2021-03-25,,2015-01-01,year,Active,Yes,,1,1,M&A,4600000,USD,4600000,4600000,USD,4600000,Seed,4600000,USD,4600000,4600000,USD,4600000,"Alumni Ventures, Unusual Ventures, Tess Ventures, Driving Forces, Jason Warner",10,"San Francisco Bay Area, Silicon Valley, West Coast","Hardware, Software",,,,,,"Communication Hardware, Developer Platform, Software","Menlo Park, California, United States",
GeneCentric Therapeutics,https://www.crunchbase.com/organization/genecentric-diagnostics,Growing,Private,For Profit,11-50,Made Acquisitions,Convertible Note,2022-09-20,,2011-01-01,year,Active,Yes,,1,6,Early Stage Venture,2500000,USD,2500000,7500000,USD,7500000,Series B,38605996,USD,38605996,41105996,USD,41105996,"LabCorp, Alexandria Venture Investments, IAG Capital Partners, Dow Jones, Hatteras Venture Partners",5,"Research Triangle, East Coast, Southern US","Biotechnology, Health Care, Science and Engineering",$50M to $100M,,,,,"Biotechnology, Health Care, Health Diagnostics","Durham, North Carolina, United States",
ftrack,https://www.crunchbase.com/organization/ftrack,Growing,Private,For Profit,51-100,"Made Acquisitions, Was Acquired",Venture - Series Unknown,2018-09-11,,2011-01-01,year,Active,Yes,,1,1,M&A,3500000,USD,3500000,3500000,USD,3500000,Venture - Series Unknown,3500000,USD,3500000,3500000,USD,3500000,Alfvén & Didrikson,1,"European Union (EU), Nordic Countries, Scandinavia","Information Technology, Sales and Marketing, Software",,,,,,"Information Technology, Marketing, SaaS, Software","Stockholm, Stockholms Lan, Sweden",
Ambra Health,https://www.crunchbase.com/organization/dicom-grid,,Private,For Profit,51-100,Was Acquired,Venture - Series Unknown,2017-11-13,,2006-01-01,year,Active,Yes,,2,8,M&A,7400000,USD,7400000,7400000,USD,7400000,Venture - Series Unknown,44284138,USD,44284138,47284138,USD,47284138,"Mayo Clinic, Canaan Partners, City National Bank, CHL Medical Partners",4,"Greater New York Area, East Coast, Northeastern US","Hardware, Health Care, Internet Services, Software",$100M to $500M,,,,,"Cloud Infrastructure, Health Care, Medical, SaaS","New York, New York, United States",
eBrands,https://www.crunchbase.com/organization/ebrands,,Private,For Profit,51-100,,Convertible Note,2023-06-01,,2020-12-01,month,Active,Yes,,2,3,,2500000,EUR,2690168,10000000,EUR,11214358,Venture - Series Unknown,17500000,EUR,20229323,20000000,EUR,22919491,"Icebreaker.vc, Varma Mutual Pension Insurance Company, Rettig Group, Veikko Laine Oy",4,"European Union (EU), Nordic Countries, Scandinavia","Commerce and Shopping, Consumer Goods, Hardware, Information Technology, Internet Services, Other, Professional Services, Sales and Marketing, Software",,,,,,"Business Development, Consumer Goods, E-Commerce, Information Technology, Internet, Marketing, Marketplace, Retail, Retail Technology, Small and Medium Businesses","Helsinki, Southern Finland, Finland",
Distran,https://www.crunchbase.com/organization/distran,,Private,For Profit,1-10,,Series B,2023-06-20,,2013-01-01,year,Active,Yes,,1,4,Early Stage Venture,8300000,CHF,9245356,8300000,CHF,9245356,Series B,8300000,CHF,9245356,10800000,CHF,12039211,"MassChallenge, Zürcher Kantonal Bank, Innosuisse, SmartEnergy Innovation Fund, Swisscanto Private Equity",5,"Europe, Middle East, and Africa (EMEA)","Consumer Electronics, Hardware, Manufacturing",,,,,,"Electronics, Manufacturing","Zürich, Zurich, Switzerland",
Jumbotail,https://www.crunchbase.com/organization/jumbotail,Growing,Private,For Profit,1001-5000,,Series C,2024-03-18,,2015-11-04,day,Active,Yes,,2,10,Late Stage Venture,1510000000,INR,18213431,1510000000,INR,18213431,Series C,164690338,USD,164690338,178585440,USD,178585440,"Alteria Capital, Invus, InnoVen Capital, Nexus Venture Partners, Kalaari Capital",29,Asia-Pacific (APAC),"Commerce and Shopping, Food and Beverage",,High,,,,"E-Commerce, Food and Beverage, Grocery, Marketplace, Retail","Bangalore, Karnataka, India",
Health Warrior,https://www.crunchbase.com/organization/health-warrior,Growing,Private,For Profit,51-100,Was Acquired,Venture - Series Unknown,2017-10-11,,2011-01-01,year,Active,Yes,,3,5,M&A,5000000,USD,5000000,5000000,USD,5000000,Venture - Series Unknown,11400000,USD,11400000,11400000,USD,11400000,"VMG Partners, NRV, Patrick O'Shea",3,"East Coast, Southern US","Commerce and Shopping, Food and Beverage, Health Care",,,,,,"Health Care, Nutraceutical, Organic Food, Retail","Richmond, Virginia, United States",
Emmersion,https://www.crunchbase.com/organization/emmersion-learning,,Private,For Profit,11-50,"Made Acquisitions, Was Acquired",Series B,2021-04-01,,2015-01-01,year,Active,Yes,,4,5,M&A,5500000,USD,5500000,5500000,USD,5500000,Series B,8500000,USD,8500000,9000000,USD,9000000,"NEXT Frontier Capital, Sepio Capital, Tamarak Capital, Imagen Capital Partners, Jeremy Andrus",7,Western US,"Artificial Intelligence (AI), Data and Analytics, Education, Science and Engineering, Software",$1M to $10M,,,,,"Artificial Intelligence (AI), EdTech, SaaS, Software","Lehi, Utah, United States",
Accrualify,https://www.crunchbase.com/organization/accrualify-inc,,Private,For Profit,11-50,Was Acquired,Series A,2018-09-12,,2015-09-01,month,Active,Yes,,2,2,M&A,3200000,USD,3200000,3200000,USD,3200000,Series A,3800000,USD,3800000,3800000,USD,3800000,"Aligned Partners, SWAN Venture Fund, Scott Lee",3,"San Francisco Bay Area, Silicon Valley, West Coast","Apps, Artificial Intelligence (AI), Data and Analytics, Financial Services, Mobile, Other, Payments, Professional Services, Science and Engineering, Software",$10M to $50M,,,,,"Accounting, Artificial Intelligence (AI), Billing, Enterprise, Finance, Financial Services, Machine Learning, Mobile Apps, Payments, Software","San Mateo, California, United States",
Dovevivo,https://www.crunchbase.com/organization/dovevivo,Growing,Private,For Profit,101-250,Made Acquisitions,Venture - Series Unknown,2021-03-08,,2007-01-01,year,Active,Yes,,1,2,,30000000,EUR,35552732,30000000,EUR,35552732,Venture - Series Unknown,80000000,EUR,91264280,80000000,EUR,91264280,"Tikehau Capital, Tamburi Investment Partners",2,"European Union (EU), Europe, Middle East, and Africa (EMEA)","Financial Services, Real Estate",,,,,,"Asset Management, Property Management","Milan, Lombardia, Italy",
Worksmith,https://www.crunchbase.com/organization/worksmith,,Private,For Profit,11-50,,Venture - Series Unknown,2020-03-23,,2015-01-01,year,Active,Yes,,1,1,,3799999,USD,3799999,3799999,USD,3799999,Venture - Series Unknown,3799999,USD,3799999,3799999,USD,3799999,Teamworthy Ventures,1,Southern US,"Mobile, Real Estate, Software",,,,,,"Facility Management, Mobile, SaaS, Software","Austin, Texas, United States",
Servixer,https://www.crunchbase.com/organization/edmunds-com,,Private,For Profit,501-1000,"Made Acquisitions, Was Acquired",Corporate Round,2020-01-29,,2018-06-27,day,Active,Yes,,2,2,M&A,50000000,USD,50000000,50000000,USD,50000000,Corporate Round,50000000,USD,50000000,50000000,USD,50000000,"CarMax, LLR Partners",2,Western US,"Commerce and Shopping, Financial Services, Internet Services, Software, Transportation",,,,,,"Automotive, Finance, Online Portals, Shopping, Software","Sheridan, Wyoming, United States",
Omnichain,https://www.crunchbase.com/organization/omnichain,Growing,Private,For Profit,11-50,,Venture - Series Unknown,2022-10-21,,2016-01-01,day,Active,Yes,,1,4,,1000000,USD,1000000,1000000,USD,1000000,Venture - Series Unknown,3000000,USD,3000000,3000000,USD,3000000,"Global Brain Corporation, Revel Partners",2,"Greater Los Angeles Area, West Coast, Western US","Software, Transportation",,High,,,,"Logistics, Software, Supply Chain Management","Los Angeles, California, United States",
Brevo,https://www.crunchbase.com/organization/sendinblue,Growing,Private,For Profit,501-1000,Made Acquisitions,Series B,2020-09-30,,2007-01-01,year,Active,Yes,,2,5,Early Stage Venture,160000000,USD,160000000,160000000,USD,160000000,Series B,197652945,USD,197652945,197652945,USD,197652945,"BlackRock, Bpifrance, Bridgepoint, Partech, Adelie",6,"European Union (EU), Europe, Middle East, and Africa (EMEA)","Advertising, Information Technology, Internet Services, Messaging and Telecommunications, Other, Sales and Marketing, Software",,Medium,,,,"Advertising, CRM, Digital Marketing, Email, Enterprise Software, Marketing Automation, Professional Services, SaaS, Sales, Software","Paris, Ile-de-France, France",
Veolia UK,https://www.crunchbase.com/organization/veolia,Growing,Private,For Profit,10001+,,Grant,2022-05-09,,1853-01-01,year,Active,Yes,,1,1,,34700000,GBP,42802464,,,,,,,,34700000,GBP,42802464,Innovate UK,1,"Europe, Middle East, and Africa (EMEA)","Energy, Professional Services, Software, Sustainability",,Medium,,,,"Developer Platform, Energy, Energy Management, Environmental Consulting, Innovation Management, Waste Management, Water Purification","London, England, United Kingdom",
Atempo,https://www.crunchbase.com/organization/atempo,,Private,For Profit,101-250,"Made Acquisitions, Was Acquired",Venture - Series Unknown,2019-09-24,,1992-01-01,year,Active,Yes,,1,4,M&A,8000000,EUR,8810912,8000000,EUR,8810912,Venture - Series Unknown,44670912,USD,44670912,44670912,USD,44670912,"Bank of America, Intel Capital, Steelpoint Capital Partners, Ridgewood Capital, Plantagenet Capital",6,"European Union (EU), Europe, Middle East, and Africa (EMEA)","Administrative Services, Hardware, Internet Services, Privacy and Security, Software",,,,,,"Archiving Service, Cloud Computing, Data Storage, Enterprise Software, Security, Software","Massy, Ile-de-France, France",
Vanu,https://www.crunchbase.com/organization/vanu,,Private,For Profit,51-100,,Venture - Series Unknown,2020-03-05,,1998-01-01,year,Active,Yes,,1,5,,8816392,USD,8816392,8816392,USD,8816392,Venture - Series Unknown,54166392,USD,54166392,54166392,USD,54166392,"Tata Capital, Norwest Venture Partners, CRV, Eastward Capital Partners, Rose Park Advisors",8,"Greater Boston Area, East Coast, New England","Hardware, Internet Services, Media and Entertainment, Mobile, Music and Audio, Software",,,,,,"Internet Radio, Software, Web Hosting, Wireless","Cambridge, Massachusetts, United States",
Scene Health,https://www.crunchbase.com/organization/scene-health,Growing,Private,For Profit,11-50,,Grant,2023-09-19,,2008-01-01,year,Active,Yes,,3,13,Early Stage Venture,,,,17700000,USD,17700000,Series B,27666000,USD,27666000,36436000,USD,36436000,"TEDCO, National Institutes of Health, Kapor Capital, Gaingels, Dreamit Ventures",17,"Greater Baltimore-Maryland Area, East Coast, Southern US","Health Care, Mobile",,,,,,"Health Care, Medical, mHealth","Brooklandville, Maryland, United States",
FINCAD,https://www.crunchbase.com/organization/fincad,,Private,For Profit,51-100,Was Acquired,Venture - Series Unknown,2019-04-12,,1990-01-01,year,Active,Yes,,1,4,M&A,12000000,USD,12000000,12000000,USD,12000000,Venture - Series Unknown,15800000,USD,15800000,27800000,USD,27800000,"Vistara Growth, Beedie Capital, Wellington Financial",3,,"Data and Analytics, Information Technology, Internet Services, Professional Services, Software",,,,,,"Analytics, Information Technology, Internet, Risk Management, Software","Surrey, British Columbia, Canada",
Rimilia,https://www.crunchbase.com/organization/rimilia,,Private,For Profit,101-250,Was Acquired,Venture - Series Unknown,2020-02-03,,2008-01-01,year,Active,Yes,,1,2,M&A,15000000,USD,15000000,15000000,USD,15000000,Venture - Series Unknown,40000000,USD,40000000,40000000,USD,40000000,"Eight Roads Ventures, Silicon Valley Bank, Kennet Partners",3,"Europe, Middle East, and Africa (EMEA)","Financial Services, Professional Services, Software",,,,,,"Accounting, Finance, Software","Bromsgrove, Worcestershire, United Kingdom",
BenchSci,https://www.crunchbase.com/organization/benchsci,,Private,For Profit,251-500,,Series D,2023-05-25,,2015-01-01,year,Active,Yes,,4,10,Late Stage Venture,95000000,CAD,69627420,95000000,CAD,69627420,Series D,156660477,USD,156660477,164160477,USD,164160477,"Creative Destruction Lab (CDL), Northleaf Capital Partners, Afore Capital, Inovia Capital, Gradient Ventures",16,Great Lakes,"Artificial Intelligence (AI), Biotechnology, Data and Analytics, Health Care, Science and Engineering, Software",,,,,,"Artificial Intelligence (AI), Biotechnology, Life Science, Machine Learning, Pharmaceutical","Toronto, Ontario, Canada",
Frubana,https://www.crunchbase.com/organization/frubana,,Private,For Profit,1001-5000,,Series C,2022-12-15,Venture Capital,2018-06-01,day,Active,Yes,"Early Stage Venture, Late Stage Venture",1,7,Late Stage Venture,,,,,,,Series C,271099653,USD,271099653,271099653,USD,271099653,"SoftBank, Y Combinator, Lightspeed Venture Partners, Notable Capital, Tiger Global Management",16,Latin America,"Commerce and Shopping, Food and Beverage, Other, Transportation",,,,,,"B2B, E-Commerce, Logistics, Restaurants","Bogotá, Distrito Especial, Colombia",1
Planner 5D,https://www.crunchbase.com/organization/planner-5d,Growing,Private,For Profit,51-100,,Seed,2015-09-01,,2014-10-10,day,Active,Yes,,2,2,Seed,1400000,EUR,1582320,1400000,EUR,1582320,Seed,2932320,USD,2932320,2932320,USD,2932320,IMI.VC,1,"European Union (EU), Europe, Middle East, and Africa (EMEA)","Consumer Goods, Design, Media and Entertainment, Real Estate",,,,,,"Architecture, Art, DIY, Interior Design, Real Estate","Vilnius, Vilniaus Apskritis, Lithuania",
Field,https://www.crunchbase.com/organization/field-intelligence-c6e7,,Private,For Profit,51-100,,Grant,2023-09-18,,2015-01-01,year,Active,Yes,,1,4,,50000,USD,50000,6763712,USD,6763712,Venture - Series Unknown,15363712,USD,15363712,15413712,USD,15413712,"Accion Venture Lab, Future Africa, Blue Haven Initiative, Sunu Capital, Newtown Partners",6,"Greater Atlanta Area, East Coast, Southern US","Health Care, Information Technology, Transportation",,,,,,"Health Care, Information Services, Information Technology, Pharmaceutical, Supply Chain Management","Marietta, Georgia, United States",
TVS Logistics Services,https://www.crunchbase.com/organization/tvs-logistics-services,Growing,Private,For Profit,10001+,Made Acquisitions,Corporate Round,2019-06-03,,1995-01-01,year,Active,Yes,,1,4,,250000000,INR,3614184,250000000,INR,3614184,Corporate Round,56614184,USD,56614184,211614184,USD,211614184,"Goldman Sachs, Caisse de Depot et Placement du Quebec, Mitsubishi Corporation, Nippon Express",4,Asia-Pacific (APAC),"Manufacturing, Transportation",,,,,,"Logistics, Manufacturing, Supply Chain Management","Chennai, Tamil Nadu, India",
FirstBlood,https://www.crunchbase.com/organization/firstblood,,Private,For Profit,1-10,,Non-equity Assistance,2017-06-21,,2016-01-01,year,Active,Yes,,4,2,,,,,,,,,,,,6100000,USD,6100000,DCU FinTech Innovation Center,1,"Greater Boston Area, East Coast, New England","Gaming, Internet Services",$10M to $50M,,,,,"Internet, Online Games, PC Games","Boston, Massachusetts, United States",
Cropin,https://www.crunchbase.com/organization/cropin-technologies,Growing,Private,For Profit,251-500,,Series D,2022-12-09,,2010-08-01,month,Active,Yes,,2,11,Late Stage Venture,1134000000,INR,13755442,1134000000,INR,13755442,Series D,46355018,USD,46355018,46355018,USD,46355018,"Google, Alteria Capital, Chiratae Ventures, Bill & Melinda Gates Foundation, Chiratae Ventures",16,Asia-Pacific (APAC),"Agriculture and Farming, Artificial Intelligence (AI), Data and Analytics, Information Technology, Internet Services, Science and Engineering, Software",,,,,,"AgTech, Artificial Intelligence (AI), Cloud Data Services","Bengaluru, Karnataka, India",
SuperMeat,https://www.crunchbase.com/organization/supermeat,Growing,Private,For Profit,1-10,,Grant,2022-06-08,,2015-12-15,day,Active,Yes,,3,4,Early Stage Venture,,,,,,,Series A,4000000,USD,4000000,4230000,USD,4230000,"Israel Innovation Authority, Starlight Ventures, BackBone Ventures, Stray Dog Capital, Beyond Impact",12,"Europe, Middle East, and Africa (EMEA), Middle East, Middle East and North Africa (MENA)","Biotechnology, Food and Beverage, Health Care, Science and Engineering",,,,,,"Biotechnology, Food and Beverage, Food Processing, Nutrition","Tel Aviv, Tel Aviv, Israel",
Snowy Hydro,https://www.crunchbase.com/organization/snowy-hydro,,Private,For Profit,501-1000,,Grant,2017-10-13,,2002-01-01,year,Active,Yes,,,2,,8000000,AUD,6312852,8000000,USD,8000000,Venture - Series Unknown,8000000,USD,8000000,14312852,USD,14312852,Australian Renewable Energy Agency,1,"Asia-Pacific (APAC), Australasia","Commerce and Shopping, Energy",,,,,,"Energy, Retail","Cooma, New South Wales, Australia",
Strategic Blue,https://www.crunchbase.com/organization/strategic-blue,,Private,For Profit,11-50,,Convertible Note,2020-09-29,,2011-07-12,day,Active,Yes,,2,13,Early Stage Venture,2157624,GBP,2775740,1277820,GBP,1655793,Series A,6366785,GBP,8820973,8524409,GBP,11596713,"Techstars, Scalar North Capital, Fox Investments",3,"Europe, Middle East, and Africa (EMEA)","Financial Services, Hardware, Information Technology, Internet Services, Software",,,,,,"Cloud Computing, Cloud Infrastructure, Financial Services, FinTech, IaaS, Information Technology, Software","London, England, United Kingdom",
SpinLaunch,https://www.crunchbase.com/organization/spinlaunch,Growing,Private,For Profit,51-100,,Series B,2022-09-20,,2014-01-01,year,Active,Yes,,2,7,Early Stage Venture,71000000,USD,71000000,71000000,USD,71000000,Series B,146000000,USD,146000000,146000000,USD,146000000,"Google Ventures, Alphabet, Kleiner Perkins, Neotribe Ventures, Airbus Ventures",21,"Greater Los Angeles Area, West Coast, Western US","Science and Engineering, Transportation",$100M to $500M,,,,,"Aerospace, Space Travel","Long Beach, California, United States",
Pendulum Therapeutics,https://www.crunchbase.com/organization/pendulum-therapeutics,Growing,Private,For Profit,11-50,,Series C,2024-02-20,,2013-01-01,day,Active,Yes,,3,9,Late Stage Venture,,,,,,,Series C,120900000,USD,120900000,121200000,USD,121200000,"Khosla Ventures, Alumni Ventures, Sequoia Capital, Mayo Clinic, Felicis",13,"San Francisco Bay Area, West Coast, Western US","Biotechnology, Health Care, Science and Engineering",,,,,,"Biotechnology, Health Care, Health Diagnostics, Medical, Therapeutics","San Francisco, California, United States",
meritnation.com,https://www.crunchbase.com/organization/meritnation-com,,Private,For Profit,501-1000,Was Acquired,Venture - Series Unknown,2017-11-03,,2009-04-10,day,Active,Yes,,2,3,M&A,5800000,USD,5800000,5800000,USD,5800000,Venture - Series Unknown,11400000,USD,11400000,11400000,USD,11400000,Info Edge,1,Asia-Pacific (APAC),"Commerce and Shopping, Education, Internet Services, Software",,,,,,"E-Commerce, E-Learning, Education, Higher Education, Online Portals","New Delhi, Delhi, India",
Spoken Communications,https://www.crunchbase.com/organization/spoken-communications,,Private,For Profit,101-250,"Made Acquisitions, Was Acquired",Venture - Series Unknown,2017-02-21,,2005-01-01,year,Closed,Yes,,2,7,M&A,5000000,USD,5000000,5000000,USD,5000000,Venture - Series Unknown,57046636,USD,57046636,58246636,USD,58246636,"Trinity Capital, Riverwood Capital, Ignition Partners, Ignition Capital",4,"Greater Seattle Area, West Coast, Western US","Hardware, Internet Services, Other, Professional Services, Software",,,,,,"Cloud Infrastructure, Customer Service, Enterprise Software, SaaS, Software","Seattle, Washington, United States",
NurseDash,https://www.crunchbase.com/organization/nursedash,,Private,For Profit,11-50,,Venture - Series Unknown,2021-11-01,,2017-01-01,year,Active,Yes,,2,4,,,,,,,,Venture - Series Unknown,625000,USD,625000,625000,USD,625000,"Village Capital, American Family Insurance Institute for Corporate and Social Impact, Third Act Ventures, VilCap Investments, SEI Ventures",6,"Greater Houston Area, Southern US","Administrative Services, Commerce and Shopping, Health Care",,,,,,"Assisted Living, Elder Care, Health Care, Hospital, Marketplace, Medical, Nursing and Residential Care, Staffing Agency","Houston, Texas, United States",
FactoryFour,https://www.crunchbase.com/organization/factoryfour,Growing,Private,For Profit,51-100,,Series A,2018-10-04,,2015-03-01,month,Active,Yes,,2,2,Early Stage Venture,5000000,USD,5000000,5000000,USD,5000000,Series A,8000000,USD,8000000,8000000,USD,8000000,"500 Global, Refactor, August Capital",3,"Greater Los Angeles Area, West Coast, Western US","Manufacturing, Software",$10M to $50M,,,,,"Manufacturing, Software","Los Angeles, California, United States",
Capsilon,https://www.crunchbase.com/organization/capsilon-corporation,,Private,For Profit,101-250,Was Acquired,Venture - Series Unknown,2016-06-08,,2004-01-01,year,Closed,Yes,,1,2,M&A,,,,,,,Venture - Series Unknown,21433995,USD,21433995,21433995,USD,21433995,Francisco Partners,1,"San Francisco Bay Area, West Coast, Western US","Information Technology, Internet Services, Software",$50M to $100M,,,,,"Cloud Computing, Document Management, Software","San Francisco, California, United States",
Panintelligence,https://www.crunchbase.com/organization/panintelligence-ltd,Growing,Private,For Profit,11-50,,Angel,2022-08-17,,2014-01-01,year,Active,Yes,,3,2,Seed,,,,,,,Angel,4500000,GBP,5787290,4500000,GBP,5787290,"YFM Equity Partners, Comhar Capital, Martin Port",3,"Europe, Middle East, and Africa (EMEA)","Artificial Intelligence (AI), Data and Analytics, Design, Information Technology, Software",,,,,,"Analytics, Business Intelligence, Data Visualization, Predictive Analytics, SaaS, Software","Yeadon, Leeds, United Kingdom",
