Ditto Inc.,https://www.crunchbase.com/organization/ditto-inc-,,Private,For Profit,11-50,,Seed,2014-01-14,,,,Active,,,,1,Seed,3000,USD,3000,3000,USD,3000,Seed,3000,USD,3000,3000,USD,3000,,,"San Francisco Bay Area, West Coast, Western US","Apps, Information Technology, Internet Services, Messaging and Telecommunications, Mobile, Platforms, Software",,,,,,"iOS, Mobile Apps, Video Chat","Burlingame, California, United States",
The Computer Way,https://www.crunchbase.com/organization/the-computer-way,,Private,For Profit,1-10,,Equity Crowdfunding,2014-11-03,,2014-10-31,day,Active,,,,1,,3000,USD,3000,3000,USD,3000,Equity Crowdfunding,3000,USD,3000,3000,USD,3000,,,"East Coast, New England, Northeastern US","Consumer Electronics, Hardware",,,,,,Consumer Electronics,"Presque Isle, Maine, United States",
Phalanx Trade,https://www.crunchbase.com/organization/phalanx-trade,,Private,For Profit,1-10,,Equity Crowdfunding,2014-11-29,,2013-04-08,day,Active,,,1,1,,3000,USD,3000,3000,USD,3000,Equity Crowdfunding,3000,USD,3000,3000,USD,3000,,,Great Lakes,"Energy, Other",,,,,,"B2B, Energy","London, Ontario, Canada",
Gigawatt Farms,https://www.crunchbase.com/organization/gigawatt-farms,,Private,For Profit,1-10,,Equity Crowdfunding,2014-10-22,,2014-02-28,day,Closed,,,,1,,3000,USD,3000,3000,USD,3000,Equity Crowdfunding,3000,USD,3000,3000,USD,3000,,,"Greater Los Angeles Area, Inland Empire, West Coast","Energy, Manufacturing, Natural Resources, Sustainability",,,,,,"Manufacturing, Renewable Energy, Solar","Indio, California, United States",
Travel and Learning Enterprises,https://www.crunchbase.com/organization/travel-and-learning-enterprises,,Private,For Profit,1-10,,Equity Crowdfunding,2014-08-20,,2014-02-27,day,Active,,,1,1,,3000,USD,3000,3000,USD,3000,Equity Crowdfunding,3000,USD,3000,3000,USD,3000,,,Western US,"Advertising, Education, Other, Sales and Marketing, Social Impact",,,,,,"Advertising, Education, Non Profit, Universities","Bountiful, Utah, United States",
MiNP Records,https://www.crunchbase.com/organization/minp-records,,Private,For Profit,51-100,Was Acquired,Series A,2017-03-15,,2016-12-22,day,Active,,,1,2,M&A,1000,USD,1000,1000,USD,1000,Series A,3000,USD,3000,3000,USD,3000,"Ajit Prasad Rijal, Nirmal Silwal",2,Asia-Pacific (APAC),"Media and Entertainment, Music and Audio",,,,,,"Media and Entertainment, Music, Music Label","Bhaktapur, Bagmati, Nepal",
Simplify,https://www.crunchbase.com/organization/simplify-corp,,Private,For Profit,11-50,,Seed,2013-05-30,,2010-06-01,day,Closed,,,1,3,Seed,1000,USD,1000,1000,USD,1000,Seed,3000,USD,3000,3000,USD,3000,,,,,,,,,,,,
Orion medical,https://www.crunchbase.com/organization/orion-medical,,Private,For Profit,1-10,,Equity Crowdfunding,2014-09-06,,2014-03-01,day,Active,,,1,1,,3000,USD,3000,3000,USD,3000,Equity Crowdfunding,3000,USD,3000,3000,USD,3000,,,Southern US,Health Care,,,,,,Medical,"San Antonio, Texas, United States",
Marco Polo Project,https://www.crunchbase.com/organization/marco-polo-project,,Private,Non-profit,1-10,,Seed,2012-12-25,,2011-05-01,day,Active,,,1,1,Seed,3000,USD,3000,3000,USD,3000,Seed,3000,USD,3000,3000,USD,3000,,,"Asia-Pacific (APAC), Australasia","Education, Internet Services, Media and Entertainment, Other, Social Impact",,,,,,"Collaboration, Crowdsourcing, Digital Media, Education, Language Learning, Non Profit, Social Media","Melbourne, Victoria, Australia",
iGrez LLC,https://www.crunchbase.com/organization/igrez,,Private,For Profit,1-10,,Seed,2012-01-30,,2012-01-30,day,Closed,,,1,1,Seed,3000,USD,3000,3000,USD,3000,Seed,3000,USD,3000,3000,USD,3000,,,"West Coast, Western US","Gaming, Mobile",,,,,,"Gaming, Mobile, Video Games","Rancho Cordova, California, United States",
Downrange Enterprises,https://www.crunchbase.com/organization/downrange-enterprises,,Private,For Profit,1-10,,Equity Crowdfunding,2014-03-19,,2014-03-19,day,Active,,,,1,,3000,USD,3000,3000,USD,3000,Equity Crowdfunding,3000,USD,3000,3000,USD,3000,,,Western US,"Other, Professional Services",,,,,,"B2B, Consulting, Legal","Herriman, Utah, United States",
PetSitnStay,https://www.crunchbase.com/organization/petsitnstay,,Private,For Profit,1-10,,Seed,2013-09-05,,2013-06-01,month,Active,,,,1,Seed,3000,USD,3000,3000,USD,3000,Seed,3000,USD,3000,3000,USD,3000,,,"Greater Phoenix Area, Western US","Community and Lifestyle, Health Care, Sales and Marketing",,,,,,"Local, Medical, Pet","Scottsdale, Arizona, United States",
bulletn.,https://www.crunchbase.com/organization/bulletn,,Private,For Profit,1-10,,Seed,2013-12-20,,2013-10-04,day,Closed,,,,1,Seed,3000,USD,3000,3000,USD,3000,Seed,3000,USD,3000,3000,USD,3000,Babson College,1,"Greater Boston Area, East Coast, New England","Events, Media and Entertainment, Mobile, Platforms, Software",,,,,,"Android, Events, iOS, Mobile","Babson Park, Massachusetts, United States",
Peap.co,https://www.crunchbase.com/organization/peap-co,,Private,For Profit,1-10,,Equity Crowdfunding,2013-12-15,,2013-05-05,day,Closed,,,,1,,3000,USD,3000,3000,USD,3000,Equity Crowdfunding,3000,USD,3000,3000,USD,3000,,,Southern US,Software,,,,,,Software,"Brenham, Texas, United States",
Charitas,https://www.crunchbase.com/organization/charitas,,Private,,,,Seed,2009-07-01,,2009-06-01,day,Closed,,,,1,Seed,3000,USD,3000,3000,USD,3000,Seed,3000,USD,3000,3000,USD,3000,,,"Research Triangle, East Coast, Southern US","Information Technology, Internet Services, Messaging and Telecommunications, Mobile, Other, Social Impact",,,,,,"Charity, Messaging, Mobile, Non Profit, SMS","Raleigh, North Carolina, United States",
Acreations Reptiles and Exotics,https://www.crunchbase.com/organization/acreations-reptiles-and-exotics,,Private,For Profit,1-10,,Equity Crowdfunding,2014-05-23,,2011-03-01,day,Closed,,,,1,,3000,USD,3000,3000,USD,3000,Equity Crowdfunding,3000,USD,3000,3000,USD,3000,,,"Research Triangle, East Coast, Southern US","Agriculture and Farming, Other",,,,,,"Animal Feed, Product Management, Service Industry","Wake Forest, North Carolina, United States",
Cesscorp World Wide,https://www.crunchbase.com/organization/cesscorp-world-wide,,Private,For Profit,1-10,,Equity Crowdfunding,2013-12-27,,2011-02-01,day,Active,,,,1,,3000,USD,3000,3000,USD,3000,Equity Crowdfunding,3000,USD,3000,3000,USD,3000,,,Great Lakes,"Advertising, Sales and Marketing",,,,,,"Advertising, Public Relations","Hamilton, Ontario, Canada",
Veterans Business Services Organization,https://www.crunchbase.com/organization/veterans-business-services-organization,,Private,For Profit,1-10,,Equity Crowdfunding,2014-07-02,,2014-06-30,day,Active,,,,1,,3000,USD,3000,3000,USD,3000,Equity Crowdfunding,3000,USD,3000,3000,USD,3000,,,Southern US,Education,,,,,,Education,"Lexington, Tennessee, United States",
Nuvem Horizon,https://www.crunchbase.com/organization/nuvem-horizon,,Private,For Profit,1-10,,Angel,2023-04-19,,2023-01-01,year,Active,,,1,1,Seed,15262,BRL,3007,15262,BRL,3007,Angel,15262,BRL,3007,15262,BRL,3007,Nanuy Souza,1,Latin America,,,,,,,,"Tabuleiro Do Norte, Ceara, Brazil",
DIDO,https://www.crunchbase.com/organization/dido,,Private,For Profit,51-100,,Series A,2015-12-12,,2015-11-02,day,Active,,,1,1,Early Stage Venture,10000000,COP,3015,10000000,COP,3015,Series A,10000000,COP,3015,10000000,COP,3015,,,Asia-Pacific (APAC),"Consumer Electronics, Consumer Goods, Hardware, Other",,,,,,"Consumer, Electronics, Home Appliances, Service Industry","Guangzhou, Guangdong, China",
Drives Me,https://www.crunchbase.com/organization/drivesme-technologies,,Private,For Profit,51-100,,Pre-Seed,2023-05-23,,2015-07-01,month,Active,,,4,1,Seed,250000,INR,3016,250000,INR,3016,Pre-Seed,250000,INR,3016,250000,INR,3016,The Startup Capital,1,Asia-Pacific (APAC),Transportation,,,,,,Automotive,"Bengaluru, Karnataka, India",
Capitl,https://www.crunchbase.com/organization/capitl,,Private,For Profit,1-10,,Pre-Seed,2022-01-03,,2021-12-01,month,Active,,,1,1,Seed,225000,INR,3024,225000,INR,3024,Pre-Seed,225000,INR,3024,225000,INR,3024,,,,Financial Services,,,,,,"Finance, Financial Services",,
ParentCare,https://www.crunchbase.com/organization/parentcare,,Private,For Profit,1-10,,Seed,2020-04-03,,2020-04-01,month,Active,,,,1,Seed,2500,GBP,3067,2500,GBP,3067,Seed,2500,GBP,3067,2500,GBP,3067,Nova Growth Capital,1,"Europe, Middle East, and Africa (EMEA)",Health Care,,,,,,"Health Care, Home Health Care, Primary and Urgent Care","London, England, United Kingdom",
Audibase,https://www.crunchbase.com/organization/audibase,,Private,For Profit,1-10,,Grant,2013-07-18,,2013-02-13,day,Closed,,,,2,Seed,6000,GBP,9111,2000,GBP,3073,Seed,2000,GBP,3073,8000,GBP,12184,Samuel East,1,"Europe, Middle East, and Africa (EMEA)","Content and Publishing, Design, Media and Entertainment, Mobile, Music and Audio, Software",,,,,,"Audio, Blogging Platforms, Browser Extensions, Mobile, Web Design","Caerphilly, Caerphilly, United Kingdom",
Tentsile,https://www.crunchbase.com/organization/tentsile,,Private,For Profit,1-10,,Equity Crowdfunding,2019-07-16,,2002-01-01,year,Active,,,1,1,,2480,GBP,3078,2480,GBP,3078,Equity Crowdfunding,2480,GBP,3078,2480,GBP,3078,Crowdcube,1,"Europe, Middle East, and Africa (EMEA)",Commerce and Shopping,,,,,,E-Commerce,"London, England, United Kingdom",
Nap App,https://www.crunchbase.com/organization/nap-app,,Private,For Profit,1-10,,Seed,2015-09-14,,2015-09-01,day,Closed,,,1,1,Seed,2000,GBP,3085,2000,GBP,3085,Seed,2000,GBP,3085,2000,GBP,3085,,,"Europe, Middle East, and Africa (EMEA)","Apps, Information Technology, Internet Services, Media and Entertainment, Messaging and Telecommunications, Software",,,,,,"Apps, Internet, Messaging, Social Media","London, England, United Kingdom",
U/Lab,https://www.crunchbase.com/organization/u-lab-0b7b,,Private,,1-10,,Pre-Seed,2022-11-14,,2021-01-01,year,Active,,,,1,Seed,3000,EUR,3096,3000,EUR,3096,Pre-Seed,3000,EUR,3096,3000,EUR,3096,IKIGAI,1,"European Union (EU), Europe, Middle East, and Africa (EMEA)","Clothing and Apparel, Design",,,,,,Fashion,"Firenze, Toscana, Italy",
Piraeus Medical,https://www.crunchbase.com/organization/piraeus-medical,,Private,For Profit,1-10,,Seed,2023-08-09,,2021-01-01,year,Active,,,1,1,Seed,3108,USD,3108,3108,USD,3108,Seed,3108,USD,3108,3108,USD,3108,,,"Great Lakes, Midwestern US","Health Care, Manufacturing",,,,,,"Health Care, Manufacturing, Medical, Medical Device","Rochester, Minnesota, United States",
Coyno,https://www.crunchbase.com/organization/coyno,,Private,For Profit,1-10,,Seed,2014-11-27,,2014-09-19,day,Active,,,2,1,Seed,2500,EUR,3116,2500,EUR,3116,Seed,2500,EUR,3116,2500,EUR,3116,Axel Springer Plug and Play Accelerator,1,"European Union (EU), Europe, Middle East, and Africa (EMEA)","Blockchain and Cryptocurrency, Financial Services, Payments, Professional Services, Software",,,,,,"Accounting, Bitcoin, FinTech, Software","Berlin, Berlin, Germany",
NewSpace Networks,https://www.crunchbase.com/organization/newspace-networks,,Private,For Profit,1-10,Was Acquired,Pre-Seed,2020-10-19,,2019-01-01,year,Active,,,3,2,M&A,3131,USD,3131,3131,USD,3131,Pre-Seed,3131,USD,3131,3131,USD,3131,,,"San Francisco Bay Area, Silicon Valley, West Coast","Government and Military, Information Technology, Science and Engineering, Software",,,,,,"Aerospace, Military, Software","San Jose, California, United States",
eville,https://www.crunchbase.com/organization/eville,,Private,For Profit,1-10,,Pre-Seed,2017-01-01,,2017-01-01,month,Active,,,1,1,Seed,3000,EUR,3159,3000,EUR,3159,Pre-Seed,3000,EUR,3159,3000,EUR,3159,,,"European Union (EU), Europe, Middle East, and Africa (EMEA)","Gaming, Sports",,,,,,"Gaming, Sports","Berlin, Berlin, Germany",
Petville Global,https://www.crunchbase.com/organization/petville-global,,Private,For Profit,1-10,,Pre-Seed,2024-05-04,,2023-05-01,day,Active,,,4,1,Seed,15000,MYR,3165,15000,MYR,3165,Pre-Seed,15000,MYR,3165,15000,MYR,3165,,,"Asia-Pacific (APAC), Association of Southeast Asian Nations (ASEAN), Southeast Asia","Community and Lifestyle, Health Care, Information Technology",,,,,,"Information Technology, Pet, Veterinary","Kuala Lumpur, Kuala Lumpur, Malaysia",
Wickks,https://www.crunchbase.com/organization/wicks-80e6,,Private,For Profit,1-10,,Pre-Seed,2021-01-23,,2023-10-01,day,Active,,,1,1,Seed,50000,EGP,3180,50000,EGP,3180,Pre-Seed,50000,EGP,3180,50000,EGP,3180,,,"Europe, Middle East, and Africa (EMEA), Middle East, Middle East and North Africa (MENA)","Apps, Artificial Intelligence (AI), Commerce and Shopping, Data and Analytics, Mobile, Other, Science and Engineering, Software",,,,,,"Artificial Intelligence (AI), B2C, E-Commerce, Marketplace, Mobile Apps, Software","Cairo, Al Qahirah, Egypt",
Bennett and Sons Machine and Supply Company,https://www.crunchbase.com/organization/bennett-and-sons-machine-and-supply-company,,Private,For Profit,,,Venture - Series Unknown,2008-12-31,,,,Active,,,,1,,3200,USD,3200,3200,USD,3200,Venture - Series Unknown,3200,USD,3200,3200,USD,3200,Advantage Capital,1,Southern US,"Commerce and Shopping, Other, Transportation",,,,,,"Consumer, Supply Chain Management, Wholesale","Muskogee, Oklahoma, United States",
Inside New Origins,https://www.crunchbase.com/organization/inside-new-origins,,Private,For Profit,1-10,,Seed,2014-06-20,,2014-01-01,year,Closed,,,1,1,Seed,3200,USD,3200,3200,USD,3200,Seed,3200,USD,3200,3200,USD,3200,,,Latin America,"Apps, Information Technology, Mobile, Software",,,,,,"Apps, Information Technology, Mobile, Software","Rio De Janeiro, Rio de Janeiro, Brazil",
Safely,https://www.crunchbase.com/organization/safely-79c5,,Private,,1-10,,Pre-Seed,2024-06-27,,2023-01-01,year,Active,,,1,2,Seed,3000,EUR,3211,3000,EUR,3211,Pre-Seed,3000,EUR,3211,3000,EUR,3211,"Growing Capital, Furthr Foundry Accelerator",2,"European Union (EU), Europe, Middle East, and Africa (EMEA)",Government and Military,,,,,,Public Safety,"Dublin, Dublin, Ireland",
Ahmedabad Business Pages,https://www.crunchbase.com/organization/ahmedabad-business-pages,,Private,For Profit,1-10,,Seed,2015-01-10,,2011-04-15,day,Active,,,1,1,Seed,200000,INR,3213,200000,INR,3213,Seed,200000,INR,3213,200000,INR,3213,,,Asia-Pacific (APAC),"Advertising, Community and Lifestyle, Media and Entertainment, Professional Services, Sales and Marketing, Social Impact",,,,,,"Advertising, Business Development, Digital Media, Social Entrepreneurship","Ahmedabad, Gujarat, India",
Aspalete,https://www.crunchbase.com/organization/aspalete,,Private,For Profit,1-10,,Pre-Seed,2016-11-16,,2016-11-16,day,Closed,,,1,1,Seed,3000,EUR,3213,3000,EUR,3213,Pre-Seed,3000,EUR,3213,3000,EUR,3213,,,"European Union (EU), Europe, Middle East, and Africa (EMEA)","Clothing and Apparel, Commerce and Shopping, Design, Sports",,,,,,"E-Commerce, Fashion, Fitness, Sports","Elche, Comunidad Valenciana, Spain",
Innvest FInances,https://www.crunchbase.com/organization/innvest-finances,,Private,For Profit,1-10,,Seed,2022-05-31,,2022-01-01,year,Active,,,,2,Seed,125000,INR,1611,125000,INR,1611,Seed,250000,INR,3220,250000,INR,3220,Aim Capital (Earlier Aentor Finances),1,"Greater New York Area, East Coast, Northeastern US",,,,,,,,"Brooklyn, New York, United States",
Major Aide,https://www.crunchbase.com/organization/major-aide,,Private,For Profit,1-10,,Seed,2013-10-01,,2013-10-01,day,Closed,,,2,1,Seed,2000,GBP,3234,2000,GBP,3234,Seed,2000,GBP,3234,2000,GBP,3234,,,"European Union (EU), Europe, Middle East, and Africa (EMEA)","Education, Information Technology, Other",,,,,,"Education, Information and Communications Technology (ICT), Universities","Warsaw, Mazowieckie, Poland",
EL3B,https://www.crunchbase.com/organization/el3b,,Private,For Profit,11-50,,Angel,2023-08-01,,2022-10-25,day,Active,,,5,1,Seed,100000,EGP,3236,100000,EGP,3236,Angel,100000,EGP,3236,100000,EGP,3236,,,"Europe, Middle East, and Africa (EMEA), Middle East, Middle East and North Africa (MENA)","Financial Services, Gaming",,,,,,"FinTech, Gaming","Cairo, Al Qahirah, Egypt",
Kating Project Indonesia,https://www.crunchbase.com/organization/kating-project-indonesia,,Private,For Profit,1-10,,Seed,2023-02-07,,2019-06-29,day,Active,,,1,1,Seed,50000000,IDR,3299,50000000,IDR,3299,Seed,50000000,IDR,3299,50000000,IDR,3299,None Provided None Provided,1,"Asia-Pacific (APAC), Association of Southeast Asian Nations (ASEAN), Southeast Asia","Design, Information Technology",,,,,,"Graphic Design, Information Technology, Product Design, Web Design","Cileungsi, Jawa Barat, Indonesia",
Acacia Trading,https://www.crunchbase.com/organization/acacia-trading,,Private,For Profit,1-10,,Seed,2014-10-20,,2014-01-01,year,Closed,,,3,1,Seed,3300,USD,3300,3300,USD,3300,Seed,3300,USD,3300,3300,USD,3300,,,"San Francisco Bay Area, Silicon Valley, West Coast","Blockchain and Cryptocurrency, Financial Services, Internet Services, Payments, Software",,,,,,"Bitcoin, Cloud Computing","Menlo Park, California, United States",
THOD - TRIP HOBBIES AND OUTDOORS,https://www.crunchbase.com/organization/thod-trip-hobbies-and-outdoors,,Private,For Profit,1-10,,Seed,2022-07-13,,2022-05-16,day,Active,,,1,1,Seed,18000,BRL,3338,18000,BRL,3338,Seed,18000,BRL,3338,18000,BRL,3338,,,Latin America,"Commerce and Shopping, Information Technology, Travel and Tourism",,,,,,"Adventure Travel, Information Technology, Marketplace, Tourism, Travel Agency","Belo Horizonte, Minas Gerais, Brazil",
Connect U,https://www.crunchbase.com/organization/connect-u,,Private,For Profit,11-50,,Series A,2019-09-20,,2019-03-16,day,Active,,,2,1,Early Stage Venture,65220,MXN,3353,65220,MXN,3353,Series A,65220,MXN,3353,65220,MXN,3353,,,Latin America,Software,,,,,,Enterprise Software,"Mexico City, Distrito Federal, Mexico",
Blend Kitchen,https://www.crunchbase.com/organization/blend-kitchen,,Private,For Profit,11-50,,Equity Crowdfunding,2020-09-04,,2016-01-01,year,Active,,,1,1,,2539,GBP,3372,2539,GBP,3372,Equity Crowdfunding,2539,GBP,3372,2539,GBP,3372,,,"Europe, Middle East, and Africa (EMEA)",Food and Beverage,,,,,,Restaurants,"Sheffield, Sheffield, United Kingdom",
AGW Bharat,https://www.crunchbase.com/organization/agw-bharat,,Private,For Profit,11-50,,Pre-Seed,2021-02-12,,2021-02-06,day,Active,,,2,1,Seed,245157,INR,3377,245157,INR,3377,Pre-Seed,245157,INR,3377,245157,INR,3377,,,Asia-Pacific (APAC),"Content and Publishing, Internet Services, Media and Entertainment",,,,,,"Digital Media, Internet, Media and Entertainment, News, Social Media","Noida, Uttar Pradesh, India",
pixelHome,https://www.crunchbase.com/organization/pixelhome,,Private,For Profit,1-10,,Seed,2015-02-02,,2015-01-21,day,Closed,,,,1,Seed,3000,EUR,3401,3000,EUR,3401,Seed,3000,EUR,3401,3000,EUR,3401,,,"European Union (EU), Europe, Middle East, and Africa (EMEA)","Consumer Electronics, Internet Services, Privacy and Security, Real Estate",,,,,,"Internet of Things, Security, Smart Home","Tarragona, Catalonia, Spain",
Ayyo Eat,https://www.crunchbase.com/organization/ayyo-eat,,Private,For Profit,51-100,,Pre-Seed,2021-08-27,,2021-01-01,year,Active,,,2,1,Seed,250000,INR,3402,250000,INR,3402,Pre-Seed,250000,INR,3402,250000,INR,3402,Shubham Singh,1,,"Food and Beverage, Transportation",,,,,,Food Delivery,,
Get Skybound Online,https://www.crunchbase.com/organization/get-skybound-online,,Private,For Profit,1-10,,Seed,2017-01-01,,2017-01-01,year,Active,,,1,1,Seed,5000,SGD,3452,5000,SGD,3452,Seed,5000,SGD,3452,5000,SGD,3452,,,Asia-Pacific (APAC),"Mobile, Other",,,,,,"Mobile, Professional Services","Jakar, Bumthang, Bhutan",
feelfood,https://www.crunchbase.com/organization/feelfood,,Private,For Profit,1-10,,Seed,2021-11-01,,2020-01-01,year,Active,,,2,1,Seed,3000,EUR,3480,3000,EUR,3480,Seed,3000,EUR,3480,3000,EUR,3480,Startnext,1,"European Union (EU), Europe, Middle East, and Africa (EMEA)",Food and Beverage,,,,,,"Food and Beverage, Organic Food","Cologne, Nordrhein-Westfalen, Germany",
Cleo Technologies,https://www.crunchbase.com/organization/cleo-technologies,,Private,For Profit,,,Seed,2024-05-31,,2023-01-01,year,Active,,,,1,Seed,3480,USD,3480,3480,USD,3480,Seed,3480,USD,3480,3480,USD,3480,,,"East Coast, Northeastern US",,,,,,,,"Albany, New York, United States",
Cogno AI,https://www.crunchbase.com/organization/cognoai,Growing,Private,For Profit,101-250,Was Acquired,Pre-Seed,2017-06-01,,2017-04-21,day,Active,,,2,1,M&A,3500,USD,3500,3500,USD,3500,Pre-Seed,3500,USD,3500,3500,USD,3500,,,Asia-Pacific (APAC),"Artificial Intelligence (AI), Data and Analytics, Science and Engineering, Software",,,,,,"Artificial Intelligence (AI), Software","Mumbai, Maharashtra, India",
Thrie,https://www.crunchbase.com/organization/thrie,,Private,For Profit,1-10,,Pre-Seed,2023-11-01,,2023-11-01,month,Active,,,1,1,Seed,3500,USD,3500,3500,USD,3500,Pre-Seed,3500,USD,3500,3500,USD,3500,Family & Friends,1,"Europe, Middle East, and Africa (EMEA)","Apps, Mobile, Software, Transportation",,,,,,"Logistics, Mobile Apps, Public Transportation, Ride Sharing, Transportation","Lagos, Lagos, Nigeria",
instaPorta,https://www.crunchbase.com/organization/instaporta,,Private,For Profit,1-10,,Angel,2019-02-28,,2017-07-01,month,Closed,,,1,4,Seed,,,,,,,Angel,3500,USD,3500,33500,USD,33500,,,"Asia-Pacific (APAC), Association of Southeast Asian Nations (ASEAN), Southeast Asia","Advertising, Apps, Data and Analytics, Sales and Marketing, Software",,,,,,"Advertising, Advertising Platforms, Apps, Big Data, Content Marketing, Social Media Advertising","Surabaya, Jawa Timur, Indonesia",
Mazedon,https://www.crunchbase.com/organization/mazedon,,Private,For Profit,1-10,,Seed,2016-01-01,,2015-11-24,day,Active,,,3,1,Seed,3500,USD,3500,3500,USD,3500,Seed,3500,USD,3500,3500,USD,3500,,,"Greater New York Area, East Coast, Northeastern US","Commerce and Shopping, Consumer Electronics, Consumer Goods, Hardware, Other",,,,,,"B2C, Consumer Goods, E-Commerce, Electronics, Hardware, Retail","New York, New York, United States",
American Bankers Association,https://www.crunchbase.com/organization/american-bankers-association,Growing,Private,For Profit,251-500,,Seed,2014-01-13,,1875-01-01,year,Active,,,,1,Seed,3500,USD,3500,3500,USD,3500,Seed,3500,USD,3500,3500,USD,3500,,,"Washington DC Metro Area, Southern US","Financial Services, Lending and Investments, Other",,,,,,"Association, Banking, Finance, Financial Services","Washington, District of Columbia, United States",
LOTCHE App,https://www.crunchbase.com/organization/lotche-app,,Private,For Profit,1-10,,Seed,2017-03-23,,2016-12-01,day,Active,,,,2,Seed,2500,USD,2500,2500,USD,2500,Seed,3500,USD,3500,3500,USD,3500,adnan nidal,1,"Asia-Pacific (APAC), Australasia","Apps, Clothing and Apparel, Commerce and Shopping, Design, Mobile, Platforms, Software",,,,,,"Android, Apps, E-Commerce, Fashion, iOS, Mobile, Software","Brisbane, Queensland, Australia",
Cookwarespace,https://www.crunchbase.com/organization/kitchen-under-100,,Private,For Profit,1-10,,Angel,2021-03-07,,2020-04-02,day,Active,,,,1,Seed,3500,USD,3500,3500,USD,3500,Angel,3500,USD,3500,3500,USD,3500,,,"Greater New York Area, East Coast, Northeastern US",Real Estate,,,,,,Home Improvement,"New York, New York, United States",
Tautachrome,https://www.crunchbase.com/organization/tautachrome,,Private,For Profit,1-10,,Seed,2020-05-15,,2015-01-01,year,Active,,,2,1,Seed,3500,USD,3500,3500,USD,3500,Seed,3500,USD,3500,3500,USD,3500,,,"Greater Phoenix Area, Western US","Information Technology, Internet Services",,,,,,"Information Services, Information Technology, Internet","Paradise Valley, Arizona, United States",
carSquatting,https://www.crunchbase.com/organization/carsquatting,,Private,For Profit,1-10,,Pre-Seed,2019-08-27,,2019-01-01,year,Active,,,,1,Seed,3500,USD,3500,3500,USD,3500,Pre-Seed,3500,USD,3500,3500,USD,3500,Laguna Ventures LLC,1,,"Administrative Services, Consumer Electronics, Real Estate, Transportation",,,,,,"Car Sharing, Office Administration, Smart Home, Transportation",,
Melboor Coin,https://www.crunchbase.com/organization/melboor-coin,,Private,For Profit,11-50,,Angel,2024-03-22,,2023-06-03,day,Active,,,,1,Seed,3500,USD,3500,3500,USD,3500,Angel,3500,USD,3500,3500,USD,3500,,,,,,,,,,,"Winnipeg, Manitoba, Canada",
AurelAurel,https://www.crunchbase.com/organization/oreelloreell,,Private,For Profit,11-50,,Pre-Seed,2020-08-04,,2016-05-16,day,Active,,,3,1,Seed,3500,USD,3500,3500,USD,3500,Pre-Seed,3500,USD,3500,3500,USD,3500,Sobhee Hakeem,1,"Europe, Middle East, and Africa (EMEA), Middle East, Middle East and North Africa (MENA)","Internet Services, Media and Entertainment, Science and Engineering, Software",,,,,,"Media and Entertainment, Social Media, Software, Software Engineering","Cairo, Al Qahirah, Egypt",
Blue Energy,https://www.crunchbase.com/organization/blue-energy,,Private,For Profit,1-10,,Seed,2016-01-01,,2011-03-20,day,Active,,,,1,Seed,3500,USD,3500,3500,USD,3500,Seed,3500,USD,3500,3500,USD,3500,Connie Huang,1,"Asia-Pacific (APAC), Australasia","Consumer Electronics, Energy, Hardware",,,,,,"Battery, Electronics, Hardware","Sydney, New South Wales, Australia",
Adcast,https://www.crunchbase.com/organization/adcast,,Private,For Profit,1-10,,Seed,2009-03-28,,2009-03-28,day,Closed,,,2,1,Seed,3500,USD,3500,3500,USD,3500,Seed,3500,USD,3500,3500,USD,3500,,,"Washington DC Metro Area, East Coast, Southern US","Advertising, Apps, Internet Services, Media and Entertainment, Sales and Marketing, Software",,,,,,"Advertising, Advertising Platforms, Apps, Social Media","Germantown, Maryland, United States",
Miami2Vegas,https://www.crunchbase.com/organization/miami2vegas,,Private,For Profit,1-10,,Equity Crowdfunding,2014-09-26,,2007-12-01,day,Closed,,,,1,,3500,USD,3500,3500,USD,3500,Equity Crowdfunding,3500,USD,3500,3500,USD,3500,,,"East Coast, Southern US","Gaming, Media and Entertainment, Music and Audio",,,,,,"Digital Entertainment, Gaming, Music","Orlando, Florida, United States",
